text,feature0,feature1,feature2,feature3,feature4,feature5,feature6,feature7,feature8,feature9,feature10,category,stance
نرد لقح امن نأم صحه طفل قبل,0,0,0,0,0,0,0,1,0,1,0,3,1
وجه ثني شكل اذا قال لقح كورو جبر,0,0,0,0,0,1,0,1,0,0,0,7,0
اير طلب حظر دخل لقح كورو امر برط رنس دعا نئب اير حكم حظر رسم إدخال لقح كورو نتج شرك امر بريطانيه رنس الى بلد اثر دعه طلق رشد علي خامنئ,0,0,0,0,0,1,0,1,0,0,0,0,1
غطه قنه وصل صحب سمو لكي امر عبدالاله بن عبدالعزيز تلق لقح يرس كورو وباستقباله وزر صحه,0,0,0,0,0,1,0,1,0,0,0,1,1
وطن مرا يشك لقح صين حكم تعش الا كذب نصب حيل وطن خرج بدي وقل خرع لقح مرا قلو ورد لقح يزر امر وفي نهي عطو لقح صين ضرب حمد لله نعم قطر حكم قطر,0,0,0,0,0,0,0,1,1,0,0,7,1
حمد عبد لقى لقح كورو,0,0,0,0,0,1,1,1,0,0,0,1,1
انا حرم كام فقد ابنهاوحوشت عنك ناس كتيركانت عيز تحط عليكى ناس كتيرجد ده غيرالب للى كنتى هتتسببى فى شوه سمع طلعتى عملتى جرب بيت دول توط ويت دول زيد بطل شككتى فى لقح كوروناجروب يدس لسم فى عسل للى عرض عند شوه سمعنايابنى,0,0,0,0,0,1,0,1,0,0,0,7,1
حمد لله اذ قده حكم شرع الل حرص طقت امن سعد ورف شعب ندر ان لقي امم مثل ادل كثر حصى اخر وفر لقح كرو وطن قيم رغم حجه دول صنع حفظ الل قئد سير ولي عهد امن خلص لوط قول امن,0,0,0,0,0,0,0,1,0,0,0,7,1
شهد لحظ تلق عهل سعد جرع ولى لقح يزر بين,0,0,0,0,0,0,0,1,1,0,0,1,1
وقع مينتور سود ردغ سوم صين اجل حصل لقح كورو كورو قبل سلم نشق اقل يغر سلم صين وذل أخر دفع لقح ورد لتر عمد صحه ركه دفع سيس شدق يغر خان فعل بغر,0,0,0,0,0,1,0,1,0,0,0,0,1
شبب خدم حرم شرف ملك سلم بن عبدالعزيز ال سعد ملك ملك عرب سعد لقى جرع ولى لقح كورو,0,0,0,0,0,1,1,1,0,0,0,1,1
كتب توت قهر وضع طعم علم طبء كبر الس رجع حيت جمع مصر حفرو قبر بإد على عجل طبع حفرو عجل لإن طغو كثر وسن ربن ارض انه طغي مكر مرد رجع صحب بعد,0,0,0,0,0,0,0,0,0,0,1,7,0
تحد ورب حرم لقح عمل وضع اليه سمح قيد صدر دول عضء كتل امر ؤثر مدد دول لقح يزر بدل ولى شرك مدد تبع ملك تحد ناج بلج اندبندنت عرب غنك,0,0,0,0,0,0,0,1,1,0,0,0,1
امت غدي خرجو لقح ضاد فقر,0,0,0,0,0,0,0,1,0,0,0,8,0
وزر صحه عمد لقح استرازينيكا ودر لقح يزر,0,0,0,1,0,0,0,1,1,0,0,0,1
طرق شفء كورو مدى حيه وهل يتم طبء بشر يجد لقح او دوء وهم عرف اين غزا الل هيه نشأ وهل كورو علق بشر ام انه يرس بشر,0,0,0,0,0,1,0,1,0,0,0,7,0
مصر بدأ حمل طعم طقم طبه ضد كورو لقح صين,0,0,0,0,0,1,0,1,0,0,1,0,1
كوب تتع اير خبر لقح ضاد كورو حال عمد ذات ظل عنا شرك نقص سيل كوب تقل ان عده دول عبر همم لقح كورو اول تفق نوع وصل اليه,0,0,0,0,0,1,0,1,0,0,0,0,1
وزر صحه شهد تلق ولى جرع لقح كورو طقم طبه دخل شفى ابوخليفه عزل اسماعيليه,0,0,0,0,0,1,0,1,0,0,0,0,1
خبر عظم إسم وطن عظم لقح سعد دخل بحل الل جرب سرر جوز رحل جرب خبر حيو نجح طرق بكر ولايحتاج درج برد علي نعش عهد سعد عظمى برك الل وطن خير حفظ قيد رشد حمد لله,0,0,0,0,0,0,0,1,0,0,0,0,1
قيد شرط شرق بدر أخذ لقح كورو ضمن حمل طعم نظم وزر صحه وقي جمع شرق خبر امر شرق,0,0,0,1,0,1,0,1,0,0,1,0,1
دول امر حصل حقق ناج لقح سينوفارم صنع صدر لدل علم جهد تكن ولد لحظ نتج عمل باق شهر قيد اماراتيه نظر لقح سعت عز ازم كورو ان تجد حلل سان يوم بتت سبق جال رؤه خلد صبح وقع,0,0,0,0,0,1,0,1,1,0,0,0,1
لقت جرع ولى لقح كورو كورو شكر قيد لتى جعل وطن قيم اول شي وكل فخر قدر تحد صعب بذن الل وزر صحه لقح كورو,0,0,0,1,0,1,0,1,0,0,0,7,1
وزر علم لقى جرع ولى لقح كورو,0,0,0,0,0,1,1,1,0,0,0,1,1
بنت الل عطه جرع لقح كورو شعر فخر لفت الل يزد يزد وسع فضل,0,0,0,0,0,1,0,1,0,0,0,7,1
ولي عهد فجر لقى جرع ولى لقح كورو عمد امر,0,0,0,0,0,1,1,1,0,0,0,1,1
رال حرى وفه مسن روج تلق لقح يزر,1,1,0,0,0,0,0,1,1,0,0,0,1
عند حدث برء صدق شعر حفد غلي علي رسل بشق كوت بذن الل لغل قرب اشف اخذ جرع ثني لقح كورو تبق عليها ايم وبذ الل كتب الل لقء حمدلل ورب حفظ جمع كره,0,0,0,0,0,1,0,1,0,0,0,8,1
سمه كمل برح ختم خبر قلت هنتكلم فصل هرد بحث صري نجح صمم لقح كورو باستخدام بيض خصب لقح دجن أخد طرق انف أقل كلف,0,0,0,0,0,1,0,1,0,0,0,0,1
لهم رزق حلل طي لهم وبر رزق لهم رزق فأن خير الر ازق خير عمن وجه كورو مان نهض تجدد ولء دار برء طرف لقح كورو قبس قلب قبس بن سعد عظم رحم الل يأب اعز رجل أنق حمدلل,0,0,0,0,0,1,0,1,0,0,0,7,1
لقح كورو شكر لله شكر ملك حبب شكر لكل سعى لرح وطن,0,0,0,0,0,1,0,1,0,0,0,7,1
طلب وفر لقح كورو دول فقر ومن يمن شكل عجل لغد شرق,0,0,1,0,0,1,0,1,0,0,0,0,1
ولل عبل لقح كسفورد,0,0,0,0,0,0,0,1,0,0,0,7,1
سعد حصل لقح استرازينيكا ضاد كورو خلل ايم عجل,0,0,1,0,0,1,0,1,1,0,0,0,1
شهد امر ترك يصل لقى اليوم جرع لقح كورو,0,0,0,0,0,1,1,1,0,0,0,0,1
امم تحد درس قرح روس حول طعم وظف ضد كورو,0,0,0,0,0,1,0,0,0,0,1,0,0
رائيل شكل دول وذج علم بشأ طعم دول كمل وجه سرع أجل رنا وعد وصل لقح زدن عدد تشر رائيل شرك يزر ومع بشر جمعاء عطي حصئ شأن سعد بلر استراتيجي عنى دحر جئح كورو,0,0,0,0,0,1,0,1,1,0,1,2,1
قال نبي حكم رحم صلى الل سلم وني ولل ان شاء الل حلف فرى غير خير الا اتت خير حلل بخر قعد علم ؤمن تبع لحق وني ولل غير ريي طعم كورو الا طلع درس علم وثق فغر ريي ضغط,0,0,0,0,0,1,0,0,0,0,1,7,1
رائيل منح ملي جرع لقح يزر امر وزر صحه فلسطينيه ضفه قطع غزه,0,0,0,1,0,0,0,1,1,0,0,0,1
وله يوم بدك تعط لجئ لقح وبد زعب اير هلأ صرت فتح ونس ههه,0,0,0,0,0,0,0,1,0,0,0,7,0
مرض عرق ودن جنس اذا قلن انو مش قدر كدل نأم لقح قيم طلب امم تحد او دول اخو ستن الف شرموط يلي سرق لسط شعب دمر سور ضطر شعب يصر جىء بدل علم سهم عنا نصر عنصر مش رح علم لقح بنا اول,0,0,0,0,0,0,0,1,0,0,0,7,0
كور شمل عملو لقح,0,0,0,0,0,0,0,1,0,0,0,9,0
عجل شرك يتر غلق حسب خامنئ جلز سبب غرد تحي علم كذب لقح كورو اير,0,0,1,0,0,1,0,1,0,0,0,4,0
اذا صح خبر حصل ملي لقح صين سعى رئس سعد حرر دول امر عرب تحي قدر كبر شكر لدل امر عرب شكر دول رئس سعد حرر,0,0,0,0,0,0,0,1,0,0,0,0,1
وصل اول شحن لقح استرازينيكا ضاد كورو الى طار هري ومد,0,0,0,0,0,1,0,1,1,0,0,0,1
او غد سبت يصل جزر,0,0,0,0,0,0,0,0,1,0,0,0,1
خبر دقق عود رشق شنط وبك حول نشأ كورو سجن رئس زرء عهد بوتفليقه عقل مرو لقح كورو مزي,0,0,0,0,0,1,0,1,0,0,0,0,0
لقح كورو نتج بشر قاح يزر بين رائيل عرب,0,0,0,0,0,1,0,1,1,0,0,0,1
خدم حرم شرف حفظ الل لقى جرع ولى لقح كورو كورو,0,0,0,0,0,1,1,1,0,0,0,1,1
ريس شمع طلب دبر استثنائي طرئ لاستيراد لقح كورو,0,0,0,0,0,1,0,1,0,0,0,0,1
جله طبه لقح سبت روس فعل نسب تزد,0,0,0,0,0,0,0,1,1,0,0,0,1
ولي تحد تعل وزع ملي جرع لقح كورو,0,0,0,0,0,1,0,1,0,0,0,2,1
نول كعب قرب منح تطع جرب جرع لقح كورو,0,0,0,0,0,1,0,1,0,0,0,0,1
غبياء فقط يصر رأي فنن رغب علم وضح لمذ رأه خصص لقح كورو وسك اول تلق بعد وصف ؤمر حكي اصل حكي يوم هتعرف عمرو ادب خليش يفت حجه,0,0,0,0,0,1,0,1,0,0,0,1,0
صحب سمو لكي امر قرن لقى لقح كورو عفو عهد يصف شهد رسل قنه خبر عفي بسم دائ الل حفظ,0,0,0,0,0,1,1,1,0,0,0,1,1
وزر اول عبد عزز جرد لقى لقح كورو جرد اول سؤل دول لقى لقح كورو,0,0,0,0,0,1,1,1,0,0,0,1,1
ترك بدأ طعم وطن عما ضمن حمل عمه طعم ضد كورو وقت وصل عدد طعم الى كثر ملي خلل سبع,0,0,0,0,0,1,0,0,0,0,1,0,1
تحر كورو سجد جدد يرس نوعتتحور باستمرار وجه تكون طعم طعم حمض نوي كفء علي لأن هدف نقط تعدد يرس ان حدث تحر لكل نقط هدف فهذ يجه حدث طعم حدث بسط طعم انفلونزا وسم,0,0,0,0,0,1,0,0,0,0,1,0,1
حسب الل نعم وكل حسب الل نعم وكل حسب الل نعم وكل الل يبر لبن ارض شعب سما ولل يبد اخذ لقح بغر وجه حق حلل يبح جعل سم زعف يجر دمه لحم جرر تم أجل وعد لقح جرع ثني لأم,0,0,0,0,0,0,0,1,0,0,0,7,1
وجه ثني كورو برط فتح ركز طعم جمع ولب يعل حله طرئ خاف خرج وضع يطر فرق قرر حمد رمل خبر,0,0,0,0,0,1,0,0,0,0,1,0,1
خدم حرم شرف لقى جرع ولى لقح كورو حفظ الل سيد أدم الل عزك أطل الل عمر,0,0,0,0,0,1,1,1,0,0,0,1,1
وزر صحه ترك خرلد كوج يعل وصل ملي لقح كورونافاك صين الى ترك غد اثن وأن خطه لقح طعم بلد بذل تسر علن أخر او اجل,0,0,0,0,0,1,0,1,0,0,1,0,1
يدو امر قرن بن عبدالعزيز تحدث جرب لقه لقح كورو شهد فخر ملك عكظ ان تكون اول طبق عكظ,0,0,0,0,0,1,0,1,0,0,0,1,1
عاااجل اعل دول سور انه شري لقح كورو لبن شتر خرج هيم هرب لسر,0,0,0,0,0,1,0,1,0,0,0,0,-1
لقح سعد ضاد كورو اعل جمع امم عبدالرحمن بن يصل نجح فرق بحث تبع قيد دكتور ايم نصر وصل الى لقح سعد ضاد كورو ذكر انه تم نهء درس سرر نشر بحث بدأ جرب اخذ وفق لزم,0,0,0,0,0,1,0,1,0,0,0,2,1
حمد لله دائ وبد لقت اليوم لقح كورو عسى ان تكون بدي خير خلص وبء كورو,0,0,0,0,0,1,0,1,0,0,0,7,1
امر ترد سد عجز ازم اله خنق ببع لقح يثب لحد الن فعل نرد لقح امن,0,0,0,0,0,0,0,1,0,1,0,0,1
حمد لله شكر سبح على اخذ اليوم طعم كورو سأل سبح ان جعل فئد وان يحم بشر جمعاء امن وكل شكر قدر حكم ملك مثل وزر صحه نظم رئع سهل بلغ جرء طعم جعل ربي ميز حسن,0,0,0,1,0,1,0,0,0,0,1,7,1
الف جرع قرب لقح اوكسفورد وصل كوت خلل سبع قدم قرب نص يزد عدد طعم يوم كمه الي وصل تكف الف شخص قرب,0,0,0,0,0,0,0,1,0,0,0,0,1
لقح اير كوب شرك ان نجت اير اول لقح خاص يرس كورو شرك كوب ناج لقح شرك رحل ثني خبر لقح بشر ستكون كوب وتح شرف عهد سور يرن رحل ثلث ستک ایر,0,0,0,0,0,1,0,1,0,0,0,0,1
تحدث صحه شكك لقح كورو سنر قرب يقف صفف تلق يدو,0,0,0,0,0,1,0,1,0,0,0,0,1
جوز صحي دلل ان لقح كورو صبح جبر رور وقت ان شاء الل ايك صحح يصر حرم رغب قنع ناس,0,0,0,0,0,1,0,1,0,0,0,2,1
عزز حكم ارد فيك طلع دكتور كفء ششه لفز يحك لقح بكل وضح وشو ثره جنب فئت عمر زي دول عمل مو عرض انو علم عم يخد بكف خفف عقل لقح كورو,0,0,0,0,0,1,0,1,0,0,0,4,-1
لقح صين سيك لعم شعب لقح يزر سيك سؤل يرد رئس ركز كفح وبئ فرس هري شئع لقح كورو ارد ملك ملك,0,0,0,0,0,1,0,1,1,0,0,0,1
جدل رنس حول لقح كورو يثر جدل رفض وسع تلق,0,0,0,0,1,1,0,1,0,0,0,0,-1
عرب وود حسن جسم يعل لقه جرع ولى لقح كورو,0,0,0,0,0,1,0,1,0,0,0,1,1
شار وبي صحه علم مجد خول دول على عدل طعم وطن ضد كورو تكون بعد جئح وزع عدل قاح لحل عرب,0,0,0,0,0,1,0,1,0,0,1,0,1
امر قرن بن عبدالعزيز الل حفظ اخذ لقح كورو ركز خصص احد صدقاء يقل دخل ركز سعد أحسب اني امر نظم قله امر انت اشف نطل الا ولل شفن أبو فهد ولل يدم فضل كرم طهر ثرى,0,0,0,0,0,1,0,1,0,0,0,0,1
حفظ ﷲ ولد قئد ملك لقى لقح كورو,0,0,0,0,0,1,1,1,0,0,0,1,1
كانت وكل ادي روج اكد يوم جمع اضي وفه شخص فتر وجز تلق جرع لقح شير الى ان ضحا عرض أعراض جنب روج لقح كورو,1,1,0,0,0,1,0,1,0,0,0,0,1
تحدث صحه شكك فعل لقح كورو يأت أخذ لقح,0,0,0,0,0,1,0,1,0,0,0,0,1
فرد جرع لقح يرس كورو تم عطؤ اليوم اي عدل الف جرع يوم وتم غطه جمل سكن دول هدف وصل الى كثر سكن دول خلل ربع اول عام,0,0,0,0,0,1,0,1,0,0,0,0,1
اليوم كانت جرع ثني لقح كورو شكر حكم رشد شكر خط دفع اول شكر لكل تزم جرء تزم جمع أخذ لقح بإذ الل تعد حيه كانت سأل الل سلم جمع,0,0,0,0,0,1,0,1,0,0,0,7,1
شهد امر ندر بن سلط لقى جرع ولى لقح كورو,0,0,0,0,0,1,1,1,0,0,0,1,1
ملك تلق لقح كورو لهم حفظ حفظ ورع برع دام عز ابا فهد مجد عوف اذ عوف كرم وزل عنك الى عدئ الم اخص برء هنئ اذا سلم فكل ناس سلم تنب خدم حرم شرف,0,0,0,0,0,1,0,1,0,0,0,1,1
تحث ظمه صحه علم شخص تلق لقح كورو حجر صحي سفر لأن وجد دلل ان لقح منع ناس صبه يرس نقل الى اخر افد كبر علماء ظمه صحه علم دكتور سوم سواميناث,0,0,0,0,0,1,0,1,0,0,0,0,1
حرم جمع يجز عمل تأم لقح شكل فرد يجب دعم حكم تأم عدد لقح كبر وهي لزم تكون شرف اول اخر لقح سبب انو بدر فرد خلق نفس سيس نتج سلب وبء كتر شيء مكن فشل اذا وضى لبن نفض,0,0,0,0,0,0,0,1,0,0,0,0,1
يدو امر ندر بن سلط لقى جرع ولى لقح كورو خبر,0,0,0,0,0,1,1,1,0,0,0,1,1
شرك يزر ستكون زيد لحظ جرع لقح كورو شهر ارس,0,0,0,0,0,1,0,1,1,0,0,2,1
ربع يحث بدر سجل حصل لقح كورو,0,0,0,0,0,1,0,1,0,0,0,0,1
خبر يقل انو ناس عم تمو تني لقح كورو يوم هلش عم بتم عيم وزر صحه علم فأي لبن عجل تخد لقح نطر رؤساء لته تا تشف نتج هيك لهم اني بلغ,0,0,0,0,0,1,0,1,0,0,0,7,-1
جرب إيجاد لقح او علج او شوف لبن برر بءت فشل,0,0,0,0,0,0,0,1,0,0,0,9,0
حق اي دول انه فخر قدم لقح واط مجا ومن دول امر اين جاز ورد امر لقح امر صين ورس قدم لفن لبن تصر عم تلق لقح جاز روج بيك برر اذا امر خرع لقح هيك عمل بلا عنى,0,0,0,0,0,0,0,1,0,0,0,7,1
وصل عدد شخص حصل لقح كورو الى ملي حول علم انت نهم,0,0,0,0,0,1,0,1,0,0,0,0,1
قدم جرع لقح كورو خلل ال سعه اضه وام,0,0,0,0,0,1,0,1,0,0,0,0,1
سمح سفر نصح حصل جوز صحي جرع لقح كورو حصل جوز عبر طبق وكل,0,0,0,0,0,1,0,1,0,0,0,6,1
تم حمد الل اخذ جرع ثني لقح كورو بكل سهل يسر غرق عمل دخل بنى الى اخذ لقح دقق فقط شكر لدولتناعلى عني واط حمي ايه خطر شكر قئم نفذ لهذا شرع عملاق كفء ادء جود نظم وحس عمل,0,0,0,0,0,1,0,1,0,0,0,7,1
دعو وزر نمه جمع شرك حمل طعم كبر وطن ضد كورو ظله حمل يدا عفى طعم تاح يوم ربعاء ركز سعد عامل جمر تعا وزر صحه وقي جمع سعه صبح الى ظهر,0,0,0,1,0,1,0,0,0,0,1,0,1
فى ظل جئح كورو دار فتى طلب دفع مول زكه جلب لقح كورو فى كدا فى دول حرم سبع قام,0,0,0,0,0,1,0,1,0,0,0,0,1
سجد عبس برمنغهام تحل ركز طعم ؤقت سعد ممه شيخ ورو صبح ركز جمع تلق لقح برط شكر امم ورو يقم نقل لقح وزع كلن معا ضد كورو شاركو بدر بلد لخر صبح روز,0,0,0,0,0,1,0,1,0,0,1,0,1
اوص لجن عبر هيئ درس جمع درس ضمن فئت ولو حصل لقح ضد كورو فصل ثني وجه لقح كورو ارد,0,0,0,0,0,1,0,1,0,0,0,2,1
عجل ياب تعل عزم ناج كمي كبر لقح استرازينيكا ضاد كورو قرب,0,0,1,0,0,1,0,1,1,0,0,0,1
ملك سلم بن عبدلعزيز حفظ الل ملك غلي اطل الل عمر ملك غلي لقى امس جرع ولى لقح كورو قبل ايض ولي عهد عدد سؤل دول بحد ذات ان لقح امن بذن الل على كلم ملك صحه انس اول ننس ابد,0,0,0,0,0,1,0,1,0,1,0,1,1
قلت ظمه صحه علم انه وجد بين نهي بشأ مكن خلط جرع لقح كورو آخر الا انه اوص بأن لقى شخص جرع لقح وأي شخص لده رد فعل حسس اي لقح نبغ ان لقى لقح كورو,0,0,0,0,0,1,1,1,0,0,0,0,1
ملك سلم لقى جرع ولى لقح كورو خبر عجل,0,0,1,0,0,1,1,1,0,0,0,1,1
رئس نفذ لشر ودر سمر فعل لقح ودر سنو رغم حجه الى زيد بين دعم دعء الا ان جسم ضده نتج لقح بشر خفض بطء شدد لذا وقع ان حمي متد بضع سنو,0,0,0,0,0,0,0,1,1,0,0,0,1
امر حرب إعلام درس قاح بقه دول تقدم حفظ قوت زعم ولآ قدم علم لقح بلا اي ضمن ذكر نرد لقح امن,0,0,0,0,0,0,0,1,0,1,0,0,1
صحه تعل وعد وصل لقح يزر الى عرق عرق ومر,0,0,0,0,0,0,0,1,1,0,0,0,1
صغر ارو عدي أخذ لقح كورو شيب عسر قصم وحل وغر نطق صحه يجب نيك شعر سعد ولآ,0,0,0,0,0,1,0,1,0,0,0,1,1
ملك سلم لقى لقح كورو,0,0,0,0,0,1,1,1,0,0,0,1,1
ههه سير يصل اذا خذت لقح كورو,0,0,0,0,0,1,0,1,0,0,0,9,0
علا فرس تعل تلق جرع ولى لقح يزر ضاد كورو ارد خبر,0,0,0,0,0,1,0,1,1,0,0,0,1
كشف حقق يرن ان لقح اير فعل ايض ضد سلل كورو جدد عرف كورو بريطانيه اعل يسر ايض انه ترد شرء لقح اير دول عرق ترد ورد لقح يزر قتل كثر سلف مدد عقد شرك تصل عمل شو طئف,0,0,0,0,0,1,0,1,1,0,0,0,1
تتج طئر خطط لكه غرب الى صين اليوم اثن لشح دفع ولى لقح سينوفارم رقب ان يصل الى ملك غد ربعاء غرب صين لقح طئر كورو,0,0,0,0,0,1,0,1,1,0,0,0,1
نرد لقح امن رجع حيه الى طبع بعد وقف يرس شي,0,0,0,0,0,0,0,1,0,1,0,3,1
جرع لقح كورو تم قدم خلل ال سعه اضه بلغ عدد جرع كلي عدل وزع جرع لكل شخص يدا عفى,0,0,0,0,0,1,0,1,0,0,0,0,1
طعم امن إطمئ ردد بدر أخذ لقح كورو خدم لوط وقي وحم إسر جمع,0,0,0,0,0,1,0,1,0,0,1,5,1
قيد ايم نصر نجح اول لقح سعد ضاد كورو جمع امم عبدالرحمن بن يصل,0,0,0,0,0,1,0,1,0,0,0,0,1
وصل عدد شخص حصل لقح كورو الى ملي حول علم انت نهم,0,0,0,0,0,1,0,1,0,0,0,0,1
شكر دول امر شكر دنو لقت جرع ولى لقح كورو كورو حفظ نفس محب جمع سأل الل صحه عفي سلم جمع,0,0,0,0,0,1,0,1,0,0,0,7,1
أمر سور تهد طفل لعب موت عنقود نرد لقح امن,0,0,0,0,0,0,0,1,0,1,0,3,1
وزر صحه حصل جرع ولى لقح كورو أخذ ثني وعد,0,0,0,1,0,1,0,1,0,0,0,2,1
رفع قبع عال قيد ؤسس طبه امن ابو ظبي يطر يرس كورو على نجح حمل طعم واستمراريت اليوم حمد الل لقت اول جرع لقح كورو شكر ابو ظبي,0,0,0,0,0,1,0,1,0,0,1,7,1
عمل لقح سينوفارم صين ضاد كورو,0,0,0,0,0,1,0,1,1,0,0,0,1
وزر لصح صهو وطن اسرائيلي يهد سلم درز سيح عما تلق طعم كورو رائيل رئد جال,0,0,0,0,0,1,0,0,0,0,1,2,1
تلف جرع لقح كورو امر سبب يقف عمل نظف ثلج خطأ,0,0,0,0,0,1,0,1,0,0,0,0,0
جزر بحث روس ناج لقح سبت كورو,0,0,0,0,0,1,0,1,1,0,0,0,1
شاءالل جلس وحد خلص وضع لقح كورو جلس جلس نوب,0,0,0,0,0,1,0,1,0,0,0,7,0
تحد ورب وصل الى تفق يزر شرء نصف ناج لقح كورو عام ركز خبر,0,0,0,0,0,1,0,1,1,0,0,0,1
سرق لق ملي نصف لقح,0,0,0,0,0,0,0,1,0,0,0,9,0
ترك طعم كثر الف شخص ضد كورو خلل يوم,0,0,0,0,0,1,0,0,0,0,1,2,1
ارد بدأ حمل طعم وطن ضد كورو سلح لقح وسط قبل تفو حفظ كورو ارد ارد حكي عام ملك,0,0,0,0,0,1,0,1,0,0,1,0,1
لقح جزه نظم علم حله وفق على معايير سلم خبر شكل جيد لقح كورو عش بصح,0,0,0,0,0,1,0,1,0,0,0,0,1
سبب صرر لقح امر وجد انه وضع نرد لقح امن,0,0,0,0,0,0,0,1,0,1,0,0,-1
صحه علم عرض طلب شهد طعم لقح كورو كشرط سفر,0,0,0,0,0,1,0,1,0,0,1,0,1
رسل وصل رئس زرء ورس جونس شرح جهد حكم حمل لقح كورو نبه فقر رسل تصل الى شرك خدم برد عضء صار حزب حفظ,0,0,0,0,0,1,0,1,0,0,0,0,1
بضع شهر رفض حمد عبس تلق سعد اماراتيه شعب لسط رسل صئب عرق علج رائيل امس قبل حمد عبس طبب عسكر جيش دفع اسرائيلي وعط لقح كورو عقل دام عبس باع قضه خان شعب طعن سكن ظهر شعب خان دين,0,0,0,0,1,1,0,1,0,0,0,0,1
شوف ذيل اير علم دجل سيد جوس يرد لقح امر لأن امر عدو شعب ربط فرس شتر لقح اير لأن صدق شعب,0,0,0,0,0,0,0,1,0,0,0,4,0
رضى سكر فئت كثر أثر ضعف كورو سجل عبر طبق صحت أخذ لقح كورو وحم نفس وعل,0,0,0,0,0,1,0,1,0,0,0,0,1
تحدث صحه وضح ونع ثلث يوص صحب حصل لقح كورو,0,0,0,0,0,1,0,1,0,0,0,0,-1
انا عالتخ عم فك رح قدر شبط يخز الف جرع لقح يزر درج حرر درج ئوه صفر طيب اذا قطع كهرب طو وتر عصف وبر افي طرح او سرق ثلا هلس لقح,0,0,0,0,0,0,0,1,1,0,0,7,0
لمذ يصب لقى لقح كورو يرس ارد حكي عام ملك,0,0,0,0,0,1,0,1,0,0,0,0,-1
عجل وزر صحه امر لاي امر حصل جرع ولى لقح كورو,0,0,1,1,0,1,0,1,0,0,0,0,1
خدم حرم شرف لقى جرع ولى لقح كورو كورو,0,0,0,0,0,1,1,1,0,0,0,1,1
حال درس حزب الل ذنب تير وطن لحر طلب صدر فتى خصه رشد على جمهور سلم اجل حصل لقح يزر امر خاص كورو يتم صنف عملاء يتم قطع عون عنهم يزر امر,0,0,0,0,0,1,0,1,1,0,0,9,1
طرب زوج قصر آخر ضد لقح كورو ثلث شجع ذكر نهي وضه وجه سئل الى فنن كبر ستى درك ذكئ,0,0,0,0,0,1,0,1,0,0,0,0,0
عجل وزر صحه رسل شحن لقح كورو جمع طقم طبه وإمكانيا سمح برد ملي جرع,0,0,1,0,0,1,0,1,0,0,0,0,1
وقح ولك عالقليله لحق لقح مش ضرر فرج كوكب ناس بلد وصل لقح بلد أسواء رحل وقت بلش كورو,0,0,0,0,0,1,0,1,0,0,0,1,1
حسن جسم لقى اول جرع لقح كورو,0,0,0,0,0,1,1,1,0,0,0,1,1
رفو لزم تكون ولو تلق لقح اتي علم شرط جلس وذا بقي لقح عطي طبء مرض ختيار مرض زمن,0,0,0,0,0,0,0,1,0,0,0,0,1
طيب انا بدي كتر لقح فعل سوق بدي اخد لقح صين يلل فعل اقل شو لحل,0,0,0,0,0,0,0,1,0,0,0,0,0
اول دفع لقح استرازينيكا تصل الى طار دبي قدم هند وذل اطر خطط هيئ صحه دبي نوع لقح إتح فرص خير خلف طعم امم هدف طعم تمش جهد بذل خلف جهز دول يطر كورو,0,0,0,0,0,1,0,1,1,0,1,0,1
لكل مر اذا خير أخذ لقح ضد كورو انا,0,0,0,0,0,1,0,1,0,0,0,7,-1
