text,feature0,feature1,feature2,feature3,feature4,feature5,feature6,feature7,feature8,feature9,feature10,category,stance
عجل شرى سره بنن لقح كورو اير حظى على وصف علم,0,0,1,0,0,1,0,1,0,0,0,0,1
سؤل ملف كورو دكتور وئل هيج طعم كورو توفر شفي خصه لأن دول سؤل أمن كدر طبه وطن شكل مجا,0,0,0,0,0,1,0,0,0,0,0,2,1
يعن حضر عم تحط لوم انه صرح هيك صرح شو نظر بلد عبر عدو وثق صفر ميه بدك يأم يخد لقح عرف شو مكن عتل بلل غرد اسم نظر مش محل لأن دول عظمى متل دول حقه رفض اكد عند قدر عمل لقح فعل قرب,0,0,0,0,1,0,0,1,0,0,0,7,1
وسل علم صين حكم لقح سينوفارم امن لقص فئه عمر عوم عما لقح كورو كورو ملك,0,0,0,0,0,1,0,1,1,0,0,0,1
زعم اخذ طعم كورو بر لكش هر صرا لبر لكش حق وبالإنتخاب جاي حق لقح صين غنم,0,0,0,0,0,1,0,1,0,0,0,7,0
رنمج امر عزم طعم نصف سكن نهي قبل ضجه علم قرر وسل وصل جمع حدد قدم برط حول رسم صور قتم وضع حول كورو دبي حقق ارض خلف وهن جرء شدد لضم صحه جمع,0,0,0,0,0,1,0,0,0,0,1,8,1
ولل حمد تلق غلي اليوم جرع ولى لقح كورو جعل عفي يرب ربي حفظ سأل الل ان نفع قبل جمل نظم وعن رئع شكر خدم حرم شرف ملك سلم شكر سمو ولي عهد امر حمد بن سلم شكر بطل صحه,0,0,0,0,0,1,0,1,0,0,0,0,1
امر نرد لقح امن,0,0,0,0,0,0,0,1,0,1,0,9,0
عبر طبق انه عرف خطو قدم طلب لقح كورو مرس صحي,0,0,0,0,0,1,0,1,0,0,0,0,1
يدو رصد وصل ولى جرع لقح كورو الى جزر منص,0,0,0,0,0,1,0,1,0,0,0,0,1
ترك تزد قبرص شمل الف جرع لقح ينف صين ضاد كورو,0,0,0,0,0,1,0,1,0,0,0,2,1
وزر صحه اصب كورو يمك سجل حصل طعم لكن فئت عطى ولو عجل كورو ارد لقح كورو ملك,0,0,1,0,0,1,0,1,0,0,0,0,1
صدق الي بلد قطع فها سكر قعد فوض لقح يزر سمح راك بهم,0,0,0,0,0,0,0,1,1,0,0,7,1
خلل سنه لقو لقح وطو صين شكل طاويط عطل عصي,0,0,0,0,0,0,0,1,0,0,0,7,0
يرس بعض عذب كورو يرس كورو إعل عجز شفء لقح دوء امم هدي نصر حمد يما ربع اخر صبح,0,0,0,0,0,1,0,1,0,0,0,7,0
لكه برط لقى لقح كورو هدف كثر صحت,0,0,0,0,0,1,0,1,0,0,0,1,1
عدد شخص تلق لقح كورو اصب صدع إرهاق آلم عضل شكل نشر خصه وقع حقن حمى خفض درج كانت جمع قصر عمر الى سعه وتم درت شكل جيد طرق,0,0,0,0,0,1,0,1,0,0,0,7,1
فعل تصل الى نوفافاكس وقع ناج قرب ملي جرع لقح كورو شهر حلل او عرب,0,0,0,0,0,1,0,1,0,0,0,0,1
خلل ساع فقط ملي شهد الف ريتو الف فضل رد فعل ضخم يدو تلق خدم حرم شرف جرع ولى لقح كورو,0,0,0,0,0,1,0,1,0,0,0,1,1
سمو امر طقه دين وره لقى جرع ولى لقح كورو كورو,0,0,0,0,0,1,1,1,0,0,0,1,1
رور قرب ثلث ابع وزع لقح كورو سجد كورو سعد وصل عدل عدد تلق جرع يوم بلد قرب الف شخص,0,0,0,0,0,1,0,1,0,0,0,0,1
رئس اير حسن روح وزر صحه يرن رفض طلب شرك جنب خبر لقح كورو وطن يرن,0,0,0,1,1,1,0,1,0,0,0,0,-1
جمهور سلم اير خرع لقح كورو دهش علم بتق علم وت مها تقن عسكر الس بحث علم نوي وت غل تها علم بتق ننو مهل ال سعد هرئ حفل إنشاء عهد علم موسيقى قي نصف,0,0,0,0,0,1,0,1,0,0,0,7,1
لجن خرج امن كنس صهو درس منع دخل لقح كورو الى قطع غزه ان تعد حمس سرى صهي,0,0,0,0,0,1,0,1,0,0,0,0,0
وزر صحه الم وقع صدق تحد ورب لقح استرازينيكا جمع قبل,0,0,0,0,0,0,0,1,1,0,0,0,1
وزر صحه تعل اليوم جمع انه رخص شكل استعجالي قاح سينوفارم ضد كورو سجد لمطابقته ميز وصف معايير عمد دول لتص ظمه صحه علم صله غرب صحه لقح صين كورو سينوفارم,0,0,0,1,0,1,0,1,1,0,0,0,1
ولآ أكد ان فعل لقح كورو صنع صين تزد فعل ائه وذل حسب جرب اجر عمل شكل وسع جدا رازيل وليس روج شهر,0,0,0,0,0,1,0,1,0,0,0,0,1
وفر مان حال لقح تاح عمم ثلث بدأ قرب جدا فهل يمك خير نوع لقح كورو مان,0,0,0,0,0,1,0,1,0,0,0,0,0
يدو قيد ايم نصر نجح اول لقح سعد ضاد كورو جمع امم عبدالرحمن بن يصل رنمج خبر,0,0,0,0,0,1,0,1,0,0,0,0,1
جرع لقح كورو ارخ ناج طبع جرع ارخ ناج بدي جرب سرر غسطس بدو نهم مكث سنو وهم حول صنع لقح ولم انت اعل يرس سحر وهم سي لقى لوم هير قصد ومت ناس,0,0,0,0,0,1,0,1,0,0,0,0,1
فصل وفه شخص تلق لقح يزر روج ان تم اعل وفه شخص فتر وجز تلق لقح شرك يزر بين ضد كورو روج لقى كثر شخص لقح اول سفن درس بلغ عمر عما اصبح,1,1,0,0,0,1,0,1,1,0,0,0,-1
دير تمو عهد سور سمي زوليخ صلح عهد عمل شهر وفر مكن قبل لقح لقح سبت طلب درج حرر ئوه لقح استرازنيكا طلب درج حرر الى درج ئوه,0,0,0,0,0,0,0,1,0,0,0,0,1
خدم حرم لقى جرع ولى لقح كورو عجل عكظ ان تكون اول طبق عكظ,0,0,1,0,0,1,1,1,0,0,0,1,1
رويترز سعد حصل لقح استرازينيكا عهد يرم هند خلل سبع,0,0,0,0,0,0,0,1,1,0,0,0,1
سعد دير صحه علم حنن بلخ حدد حجه جسم جرع خرى لقح كورو عام او حاج درس طعم عبر انف يعط نعه خلف عرب,0,0,0,0,0,1,0,1,0,0,1,0,1
سفن حرب روس نقل لقح سبت,0,0,0,0,0,0,0,1,1,0,0,0,1
ثنء عطء لقح كورو كورو فرق طبي شفى عزل لوي حفظ نيا طمئ,0,0,0,0,0,1,0,1,0,0,0,2,1
خصم طعم دبي حصل لقح كورو,0,0,0,0,0,1,0,1,0,0,0,0,0
حمل كلف تحد كره طلب إدراج فرق جدول لقح كورو فصل,0,0,0,0,0,1,0,1,0,0,0,2,1
عدد ؤسس علم كوت عنه برع طور بحث علم ورع بدع دعم خرع عدد بعض مر عشر سنن بميزانيه هول جدا اين ردد فرض ان كنا الن وصل طقم رود فضء شرك يجد طعم مرض معد كورو اقلهاحارب صحر كشف زرع,0,0,0,0,0,1,0,0,0,0,1,8,1
بين وضح عده جدل مواعيد جرع لقح كورو كورو,0,0,0,0,0,1,0,1,0,0,0,0,1
رفق امي اطل الل عمر تلق جرع ثني لقح كورو حمد لله رعي صحه عظم سحق ثنء شكر قيد رشد تضع صحه جمع اهم ولو وجب ان كتف أخذ طعم يدا عفى شكر,0,0,0,0,0,1,0,1,0,0,1,7,1
لقح اير شهر جرب سرر لقح اير ضد كورو بريطانيه حدث اثب فعل وزر صحه يسر بشر فوض شرك يرن نجه قاح شرئ واعتماده,0,0,0,1,0,1,0,1,0,0,0,0,1
حفظ الل خدم حرم شرف ملك سلم بن عبدالعزيز أمد الل صحه عفي دعم واصل بدي جئح وإم هئل إحتواء يرس شهد ثيل ستى علم طعم كورو لقح كورو,0,0,0,0,0,1,0,1,0,0,1,7,1
رئس صندوق ثمر روس سعد صبح ركز وجس وزع لقح سبت استرازينيكا شرق وسط فرق كورو لقح كورو,0,0,0,0,0,1,0,1,1,0,0,0,1
نشر وزر بلج سعر لقح والتي روح ورو جزر خار لقح روس تخلف علم والتي نشر اليوم بحث تعلق بسبوتنيك ورو اذن سعر كفء لقح سمع روس كان عير نظم بحث دعم حسب صحه جزر,0,0,0,0,0,0,0,1,1,0,0,0,0
وزر صحه تبل غنا رسم وصل شحن ولى لقح استرازينيكا سبع اخر,0,0,0,0,0,0,0,1,1,0,0,0,1
ؤمر وجد شبع نظر ؤمر جهل او عجز طبق مثل لقح كورو اثر جنب عمك لقح كزز اخد درس انا معي شي صدق ورم يدو ثني رفع حرر طفح جلد اي علج أثر خلف انس آخر بلر فهم,0,0,0,0,0,1,0,1,0,0,0,0,-1
رجل عمل برع وزع لقح كورو صري,0,0,0,0,0,1,0,1,0,0,0,0,1
حمدلل ان يسر اخذ جرع ولى لقح كورو يزر وصل كنت احس الل بقو بلغ مدح نظم لطف عمل شبب وشب وزر صحه اشف بعي اقل يتو حقهم مدح حقق نظم لطف يفق وصف,0,0,0,1,0,1,0,1,1,0,0,0,1
لقت اليوم ولل حمد جرع ولى لقح كورو اسل الل ولن عفي ودم ملك بصح سلم شكر خدم حرم شرف حفظ الل ولي عهد امن رعي كرم شكر كدر صحه وزر صحه,0,0,0,1,0,1,0,1,0,0,0,7,1
صحه برم الل سلم جرع لقح تقل بكل وقح أوضح شخر صرح صحف ان دفع ستكون خصص رئس حمد عبس لجن ركز لحر فتح كبر شخص رضي فلسطينيه ناس تعد تكون يرس نسخ للي فكر نخب جدد شرع,0,0,0,0,0,0,0,1,0,0,0,0,1
حاج الن لقح ضاد نفس دوم,0,0,0,0,0,0,0,1,0,0,0,8,0
لسط لقح اسرائيلي صبح اول شعب حصن ضد كورو تبع فصل سئي رائيل لقح كورو,0,0,0,0,0,1,0,1,0,0,0,0,0
ويا عشر قاد بشر وص اع قرر شعب إلى شده بشر عرب عجم الم سل كفر سمع عقل نفت لحق قول فصل هزل امم نصر حمد يما ربع اخر لقح كورو,0,0,0,0,0,1,0,1,0,0,0,0,1
نئب عقد ملي جرع لقح كورو ؤكد همم بصح صري,0,0,0,0,0,1,0,1,0,0,0,0,1
طلق عمل لقح ضد كورو عصم اول وطن لقى لقح سبت,0,0,0,0,0,1,1,1,1,0,0,0,1
نول زغب وضح قصد حول لقح كورو,0,0,0,0,0,1,0,1,0,0,0,1,0
رسم دكتور جمع امم ذيع سأل رئس شرك يزر سيد برت ولر لمذ لقى طعم كورو الن يرد انا بلغ عمر عام بصح جيد عمل فى خطط ممي لذا طعم وصى نسب,0,0,0,0,0,1,0,0,1,0,1,0,-1
لقى امر طقه دين وره امر يصل بن سلم سمو نئب امر سعد بن خلد يصل اليوم جرع ولى لقح كورو ركز نجد طبي ايذ تدش ركز لقح كورو طقه,0,0,0,0,0,1,0,1,0,0,0,1,1
بدي ازم كورو قال احد علماء ذكر ان كورو ان وجد طعم يصب عدد علم وقل اخر يصب شخص لله حمد وجد طعم الن ودل سبق وفر حمي عدد صاب دول خرى هئل رقم كبر جدا طعم حمي شخص جمع,0,0,0,0,0,1,0,0,0,0,1,0,1
لقح جدد كورو ظهر فعل جرع ولى فقط,0,0,0,0,0,1,0,1,0,0,0,0,1
اخذ قلل جرع ثني لقح كورو الل نفع حفظ جمع كره شكر حكم رشد همم بصح وطن شكر ايض أبطال صحه طار ملك عبد عزز قدم جهد شكر عليها,0,0,0,0,0,1,0,1,0,0,0,7,1
سعد حرر بلد بلد قدر يأم لقح قدر يأم سعد بلد وشو تأم اقل وجب شكرو لأن غيرو فكر الا نكف سيس عرب قاذ,0,0,0,0,0,0,0,1,0,0,0,2,1
روس كشف ستر لقح نفى جدد واج عرك كورو,0,0,0,0,0,1,0,1,0,0,0,0,1
اخذ اليوم جرع ولى لقح كورو بحمدالله,0,0,0,0,0,1,0,1,0,0,0,7,1
وزر صحه حصل جرع ولى لقح كورو أخذ ثني وعد سعد,0,0,0,1,0,1,0,1,0,0,0,0,1
عمل لقح يزر خدم لقح يزر شفر جين يرس يتم حقن جسم دخل خلا جسم حفز جهز نعي ناج جسم ضده عند صبه يرس كورو تقم جسم ضده حرب يرس لقح كورو لقح يزر,0,0,0,0,0,1,0,1,1,0,0,0,1
قئد قوت دفع جوي لكي لقى جرع ثني لقح كورو,0,0,0,0,0,1,1,1,0,0,0,1,1
اكد دير دره نعه لقح ظمه صحه علم دكتور كثر وبر ان تلق جرع ولى لقح كورو بدأ ظهر جاب نعي جيد لدي غضن سبع قرب عرب,0,0,0,0,0,1,0,1,0,0,0,0,1
لجن طرئ خصه تبع نظم صحه علم توص عدم شرط دول حصل سفر اليها لقح ضد يرس كورو كوت خزعبل بيت ابراهيمي,0,0,0,0,0,1,0,1,0,0,0,2,1
ستكون شرك احتفاليه ئوه دول ارد هرج اغن وطن هرج جرش ثقف فنن شرط أخذ لقح كورو,0,0,0,0,0,1,0,1,0,0,0,0,1
حدد اليوم هدف وطن شكل اسس خرج جئح كورو مثل طعم يقل وطن بلغ عام فما غضن سبع انه ثاب هدف قبل حقق بأن نسب نهم تلق طعم فعل أمل بأن نست خلل سبع قبل,0,0,0,0,0,1,0,0,0,0,1,0,1
شار وزر صحه فتح سجل وقع لقح كورو وفر أعداد نسب لقح كورو,0,0,0,0,0,1,0,1,0,0,0,0,1
افي لقح عنصر لأن وضع زاد حده كثر ولل,0,0,0,0,0,0,0,1,0,0,0,8,0
جرع لقح كورو تم قدم خلل ال سعه اضه بلغ عدد جرع كلي عدل وزع جرع لكل شخص يدا عفى,0,0,0,0,0,1,0,1,0,0,0,2,1
صحه عده جدل عطء لقح كورو لمن حصل وعد جرع ولى سبب أخر شرك يزر ورد ملك,0,0,0,0,0,1,0,1,1,0,0,0,1
وقف انس فرد جزر قسم حصت لقح كورو ونس,0,0,0,0,0,1,0,1,0,0,0,0,1
ليك الل سوا لقح كورو ثلي,0,0,0,0,0,1,0,1,0,0,0,7,1
وزر صحه اول لقح سي عطى رؤساء ثلث أسباب عني أسو بقد علم ليب ديب,0,0,0,0,0,0,0,1,0,0,0,0,1
خدت طعم كورو حنكتب شوه علم,0,0,0,0,0,1,0,0,0,0,1,7,0
لقت اليوم جرع ولى لقح كورو شكر لول امر قده قده جعل صحه انس اول شكر وصل أبطال صحه هنت ادء عمل ورق عمل سأل الل صحه سلم جمع,0,0,0,0,0,1,0,1,0,0,0,7,1
روس تعل عدد زود مصر بتكنولوج صنع لقح كورو,0,0,0,0,0,1,0,1,0,0,0,0,1
حقق وقع ان الم جنس خطر كورو تحص كورو لقح وتم ولل حمد حصر مرض جنس مرض فحل تحص وطن وحد سحب جنس عطه قوه نفذ,0,0,0,0,0,1,0,1,0,0,0,0,1
دكم شكل حكم دكم دقق الي دكم حقق إنفجار يرو دكم لقح كورو اي همم جاء دول أصعب لحظ مرق لبن قتل سرق فقر فجر عمي شو بعد عم عمل وشو نفع وجد سلط,0,0,0,0,0,1,0,1,0,0,0,7,1
حمدلل اخذ جرع ولى لقح كورو شكر شكر حجم سمء حكم رشد اتل عني همم شكر وزر صحه علي وزر وفق ربع وجد عنا ثنء اخذ جرع زملائ بطل صحه,0,0,0,0,0,1,0,1,0,0,0,7,1
وفق لشر حلل بين ولي تحد قدر ناج قرب لير جرع لقح كورو نهي عام دول تلت قئم جاك علم جاك رقم,0,0,0,0,0,1,0,1,0,0,0,0,1
اهم لقح كورو حدث عنه عمد كله علم طبه طبق كلف جمع جده واستشاري لطب جزئ يرس نذر هرش,0,0,0,0,0,1,0,1,0,0,0,0,1
حمد سمر سخر بيع سيس لقح كورو صري دا سعد ام سيس عيش هيدفع فلس فيش حجه بلش,0,0,0,0,0,1,0,1,0,0,0,7,0
وصل لقح كورو علب تطل قان جلس لنو اب يعن حت بلل قاح بر جمع بقر رول صير,0,0,0,0,0,1,0,1,0,0,0,0,0
ملي جرع لقح ودر لحق لقح يزر بين أوروب تحد ورب صدق خدم لقح ودر امر اثب نتج اول فعل نسب بذل ضمن ورب لير جرع لقح حمل ضد كورو كورو بدأ بلد حمل طعم,0,0,0,0,0,1,0,1,1,0,1,0,1
عجل رسل عرب جدد عهل غرب يوج إطلاق عمل طعم وسع ضد كورو بدء سبع قدم,0,0,1,0,0,1,0,0,0,0,1,0,1
يدو طلق حمل وعو ثقف خصه أهم اخذ لقح كورو طقه نجر شار جهت حكم مهد بدء وفر لقح هدف وعه فعل لقح حمد فرج عكظ ان تكون اول طبق عكظ,0,0,0,0,0,1,0,1,0,0,0,5,1
صحه الف وطن سجل لقى لقح كورو خلل ساع جرب وقع كورو,0,0,0,0,0,1,0,1,0,0,0,0,1
شهد وصل دفع ثني لقح كورو صين الى ترك وصل الى طار طنبول فجر اثن طئر تبع خطط جوه ركه حمل دفع ثني لقح صين ضاد كورو ذكر ان طئر نقل لاي جرع اصل لاي جرع دفع ثني,0,0,0,0,0,1,0,1,0,0,0,0,1
سلط سلم مئه الف جرع لقح كسفورد استرازينيكا ضاد كورو كورو قرر فرس بن جمع وهب ركز خبر,0,0,0,0,0,1,0,1,1,0,0,0,1
سأل الل عظم ان حفظ يرع يطل عمر ملك تلق لقح كورو,0,0,0,0,0,1,0,1,0,0,0,1,1
امر حقق على عدل وزع جرع لقح كورو فئت ؤهل طبا جوز جرع لكل شخص وام,0,0,0,0,0,1,0,1,0,0,0,0,1
دكتور حمد رمح خلل ايم تلم شحن لقح شرك ودر رسل قطر,0,0,0,0,0,0,0,1,1,0,0,0,1
يمكن اخذ لقح كورو صبه يرس وهل يجب أجل جرع لقح حال صبه مرض خلل فتر لقه,0,0,0,0,0,1,0,1,0,0,0,5,1
عجل خطر وفه شخص روج برط تلق لقح يزر برط سيأ عرق رئس قسم نعه جمع ندآ حذر علج ارد ان نقش حكم فتم نعه,1,1,1,0,0,0,0,1,1,0,0,0,-1
طلع اير تبع حزب الل بطل بده ورد لقح يزر لان سيد حسن قال عند ثقه أمر,0,0,0,0,0,0,0,1,1,0,0,7,0
اعل يشل انه تلغ ايم حجر زئر سيح دول ظهر شهد طعم صلح شرط رور يوم جرع ثني انه ازل طلب نتج سلب تزد مدت سعه,0,0,0,0,0,0,0,0,0,0,1,0,1
بحر امل بدن لقح سحه صغر ايد نبه كفي تشف,0,0,0,0,0,0,0,1,0,0,0,7,-1
وجد خطه بدل وزر صحه يصل لقح اخر يزر كسفورد ثلا وهل يجز طبا اخذ جرع ثني لقح اخر الا أثر فعل لقح اذا تم اخذ جرع ثني ابع يوم وليس ابع الى ابع,0,0,0,1,0,0,0,1,1,0,0,0,1
حتج لقح قوم فرط فكر,0,0,0,0,0,0,0,1,0,0,0,8,0
اخد اول جرح لقح كورو حفظ الل,0,0,0,0,0,1,0,1,0,0,0,7,1
مارسيل يحل لعب الى مقر لقح كورو,0,0,0,0,0,1,0,1,0,0,0,0,1
لقح كورو نقط امن عمد فعل مجر ؤثر جين عش بصح,0,0,0,0,0,1,0,1,0,0,0,7,1
شي تكر بنت وطن لقى اليوم جرع ثني لقح كرو لفت نبه ان ابن عطه جرع,0,0,0,0,0,0,1,1,0,0,0,1,1
فرق عجب شذذ افق حثل شعب شمو ويأ عمل بوط أتو علم بوط أتو طلب سعد وطن ويأ أخذ لقح كورو نسم,0,0,0,0,0,1,0,1,0,0,0,8,0
صور ملك سلم لقى جرع ولى لقح كورو نيم,0,0,0,0,0,1,1,1,0,0,0,1,1
طهر دفع شرر ان شاء الل ملك لقى لقح كورو,0,0,0,0,0,1,1,1,0,0,0,1,1
يري الل طلع لقح كور طلع لقح ذكر تقي رجل,0,0,0,0,0,0,0,1,0,0,0,8,0
ملك حصل لاي جرع لقح استرازينيكا هند خلل سبع,0,0,0,0,0,0,0,1,1,0,0,2,1
جمع امم عبد رحم بن يصل سعد تعل نجح وصل الى لقح ضاد يرس كورو,0,0,0,0,0,1,0,1,0,0,0,0,1
لقح يزر ودر يغر نتج سحه أخذ لفم انف اذا كانت نتج فحص قرأ طرق دقق دول علم شخص اصب تلق لقح خطأ فالتطعيم بأي لقح ذكر عله خلف بقه لقح طرح حال,0,0,0,0,0,0,0,1,1,0,1,0,1
لقح سبت,0,0,0,0,0,0,0,1,1,0,0,9,0
علي دكتور حمد بن حمد سعد وزر صحه لقى جرع ثني لقح كورو جمع وشر خصص,0,0,0,0,0,1,1,1,0,0,0,1,1
ايم نصر كتب قصه نجح وطن وصل الى اول لقح سعد ضد كورو دعم وزر علم,0,0,0,0,0,1,0,1,0,0,0,0,1
ارخ لقح كورو جدل عمل لجن فنه وزر صحه دون يلي ولم ظهر جدل رفق اسم شرك اسم وكل قدم علم ان وزر صحه عام وزر علي حسن خلل صدر قرر,0,0,0,1,0,1,0,1,0,0,0,2,1
الى سيد وزر صحه حرم اش وقع اش طري وعد رسم وصل لقح كورو وعد طلق حمل طعم كبرى,0,0,0,0,0,1,0,1,0,0,1,0,1
سئل دكتور خرع او كشف لقح شلل طفل يمل برء خرع أجب ناس وهل شمس برء خرع رسم سغل نهز كرث زيد ربح,0,0,0,0,0,0,0,1,0,0,0,8,0
حمد بن زيد جهد فخر امر ابض نجح قدم كثر ملي الف جرع لقح الى وطن قيم دول وهذا ؤكد نجح سير عمل طعم ضد كورو بين قرئ دائ,0,0,0,0,0,1,0,1,0,0,1,0,1
اعل جمع امم عبدالرحمن بن يصل ان فرق بحث سعد قيد ايم نصر توص الى لقح ضاد كورو كورو كمل درس سرر بدأ جرب سرر اخذ وفق لزم خبر فرح جمع عرب,0,0,0,0,0,1,0,1,0,0,0,0,1
برط ملي شخص تلق جرع ولى لقح كورو عرب عجل,0,0,1,0,0,1,0,1,0,0,0,0,1
عقد امر حسم عشر قرر تفد بأن لقح وهم كورو سام قتل وجد اي برر ظمه اليوم رار دمر دول بشر,0,0,0,0,0,1,0,1,0,0,0,0,-1
حتج لقح ضد فكر زيد,0,0,0,0,0,0,0,1,0,0,0,8,0
لسط اول دول شرق وسط وفق خدم لقح سبت روس ضد كورو,0,0,0,0,0,1,0,1,1,0,0,0,1
دول سجل على عدل لقح علم ضد كورو غرب لقح كورو كورو كورو كورو كورو غرب,0,0,0,0,0,1,0,1,0,0,0,0,1
وفه يوم صعد صرخ غاث وقف نزف طبء مصر وفر لقح كورو بشر مصر كورو كورو كورو كورو,1,1,0,0,0,1,0,1,0,0,0,0,1
سيد خدم حرم ملك سلم بن عبدالعزيز لقى جرع ولى طعم كورو لهم جعل حصن شفء,0,0,0,0,0,1,1,0,0,0,1,1,1
يدو امر دين وره لقى جرع ولى لقح كورو,0,0,0,0,0,1,1,1,0,0,0,1,1
دونيس جلس علماء سعد إصدار فتى حول لقح ينف بيت صين,0,0,0,0,0,0,0,1,0,0,0,0,1
نقم حمل وعه دول خلج تلق لقح كورو خلج عرب اثن بتق قدس لفز عرب,0,0,0,0,0,1,0,1,0,0,0,0,1
لقت حمد الل جرع ثني اخر لقح يزر رور ابع جرع ولى تبع حمد قرش كورو,0,0,0,0,0,1,0,1,1,0,0,7,1
رئس امر بيد وعد امر حصل عدد كفي لقح كورو طعم امر نهي فصل صيف,0,0,0,0,0,1,0,1,0,0,1,2,1
صوت يرز اخذ لقح كورو,0,0,0,0,0,1,0,1,0,0,0,0,1
كشف يهو انه وجب تفق شرك يزر يتم تحه بين قبل لاي جرع لقح كورو وعد بشح الف الى الف جرع سبع وان عدد اصب علي كين صهو مثل فرص لشر يزر حصل نتج فيد جدا,0,0,0,0,0,1,0,1,1,0,0,2,1
رأي وقف لقح كورو قدم بين علم سيد علي فضل الل,0,0,0,0,0,1,0,1,0,0,0,0,0
طلق وزر صحه اليوم عمل لوجيستيكيه خصه وزع لقح كورو تم جهز جرع ستى وكل قله ثلج يضء عمل شمل وزع لقح كفه جهت ملك وذل شكل عدل صرح سؤل وزر صحه وقع قنه ثني,0,0,0,1,0,1,0,1,0,0,0,0,1
جرع لقح كورو تم قدم خلل ال سعه اضه بلغ عدد جرع كلي عدل وزع جرع لكل شخص يدا عفى,0,0,0,0,0,1,0,1,0,0,0,2,1
لسر ورء خصر فتر خبر لقح كورو سنو عتد الى بضع شهر نقش شيق دكس امس ماع,0,0,0,0,0,1,0,1,0,0,0,0,0
زوج منى مرض شفى رامبام تلق وجب ثني طعم ضد كورو يوم وصل دعه صندوق رضى وزر صحه تلق طعم اليوم كثر ربع مواطنو رائيل طعم حتى اخر اذر يتم طعم غلب سكن دول,0,0,0,1,0,0,0,0,0,0,1,7,1
صحف يرو بريطانيه خمس نئب كبر سؤل طبي جلتر جوناث فان تام وئل تعط لقح اوكسفورد وصل عدد شخص تلق حقن لقح الى ملي شخص ظهر سلل برازيليه جدد يرس كورو سجل جدد وفي يوم برط,0,0,0,0,0,1,0,1,0,0,0,0,1
نهر جوم حسن جسم لقى اول جرع لقح كورو,0,0,0,0,0,1,1,1,0,0,0,1,1
وكأ زيد سكن سبب خرب مش عقل خرب الل بتح بلد سبب خرب صين عدد لير ونص قصد اقي قصد علم فعل انت حتج طعم حدد نسل عشن جمع نضف مثل,0,0,0,0,0,0,0,0,0,0,1,0,1
ولد حفظ الل عام اخذ لقح يرس كرو ايم حمد لله بدن اي عرض ولآ نظر جرع ثني لقح قال سلب لقح صحح حفظ الل جمع رفع وبء بلء خير,0,0,0,0,0,0,0,1,0,0,0,7,1
تم قبض دكتور فرل هيلز سيم جولد وهي طبب نقد لقح وهم كورو,0,0,0,0,0,1,0,1,0,0,0,0,0
صندوق ثمر روس بشر يقل ان دول تقر لقح سبت,0,0,0,0,0,0,0,1,0,0,0,0,1
يصح طول سنه يبن لقح ولم جاء لقح يبن خذو تبن سطر وله وش,0,0,0,0,0,0,0,1,0,0,0,7,1
سمو نئب امر ريض لقى جرع ولى لقح كورو يشد جهد بذل شأن تقم جهت خصه جرء حرز واج وبء واس عام,0,0,0,0,0,1,1,1,0,0,0,1,1
شار مرض صدر شفى ربج ارس وحد حمد لقح كورو تطع وجه نسخ جدد يرس عرب,0,0,0,0,0,1,0,1,0,0,0,0,1
بحمدالله لقت اليوم جرع لقح كرو شعر فخر ظله وله امر حفظ الل حكم رشد قدم خدم ضهي دول تقدم رحل شهد ركز قاح كدر طنه حسن قبل نظم كفء علي ادء ادء همه,0,0,0,0,0,0,0,1,0,0,0,7,1
