text,feature0,feature1,feature2,feature3,feature4,feature5,feature6,feature7,feature8,feature9,feature10,category,stance
وزر صحه بدأ احد قدم طعم فئه هدف جدد فئت جمع ضمن رحل ولى حمل وطن تحص ضد كورو باستخدام لقح الم صن شرك استرازينيكا تعا جمع كسفورد,0,0,0,1,0,1,0,1,1,0,1,2,1
سفر امر يصف سعد كلم ؤثر طعم لقح كورو,0,0,0,0,0,1,0,1,0,0,1,1,1
رجل عمل برع صندوق تحا مصر وزع لقح كورو صري,0,0,0,0,0,1,0,1,0,0,0,0,1
حمد حسن اول لقح سي عطى رؤساء ثلث أسباب عني أسو بقد علم الل يشب شي ال قده علم عم قحو حسب كمن كورو,0,0,0,0,0,1,0,1,0,0,0,0,1
يرو وفه تطع اجر عليها جرب لقح صين ضاد كورو,1,1,0,0,0,1,0,1,0,0,0,0,-1
نبي لقح حق ذبن,0,0,0,0,0,0,0,1,0,0,0,8,0
رسل عرب ارس ليث بزر الف رنس تلق لقح كورو أكثر ملي اكد رغب اخذ جرع,0,0,0,0,0,1,0,1,0,0,0,0,1
ذهب ذكر وقت اعل لقح كورو ذهب خفض ذهب نفس ستي نخب ولي جورج امس الش هام انه عند تعد سعر صعد سسب حدث سيس نقط هبط سبق ماتتجاوز سعر على ستو كبر,0,0,0,0,0,1,0,1,0,0,0,9,0
طلع قصه ملي لقح صين يلي نسب رئس حرر مش اكد,0,0,0,0,0,0,0,1,0,0,0,4,0
لقح شرك يزر جيش شرط قضء رجل عمل وعل انم بقي شعب فقر هيصبح فئر جرب مصل ورد علم احد عنه شيئ مش وخد لقح ثور قدم جمع,0,0,0,0,0,0,0,1,1,0,0,0,1
بين اسرائيليه فعل لقح يزر تصل الى شخص اصل الف تلق جرع لقح يزر اصب كورو وهي نسب قلت سؤل اسرائيليه انه وعد شجع,0,0,0,0,0,1,0,1,1,0,0,0,1
ولد حلا بعد نجح حفل ليل رأس سنه لبن لقى اول جرع لقح كورو دبي,0,0,0,0,0,1,1,1,0,0,0,1,1
سرع بلد إعطاء جرع واط وبروباغندا دول خرى شخص فقط تلق لقح كورو مصر,0,0,0,0,0,1,0,1,0,0,0,3,1
لحظ تلق لقح كورو خلو لذه لذه ثقه علم لذه حسس نصر وبء لذه دحر خرف لذه خرج نفق خوف لذه ادء تحه نقذ بشر لذه شعر بأن وطن دول عصر يعن امن وأم,0,0,0,0,0,1,0,1,0,0,0,7,1
امر قدم كثر الف جرع لقح كورو خلل سعه اضه,0,0,0,0,0,1,0,1,0,0,0,0,1
شاء الل برك الل كثر شخص لقى لقح كورو وطن غلي طمئ نتم سعد,0,0,0,0,0,1,0,1,0,0,0,0,1
جئو سور ارد تلق طعم كورو هده سمء ربط خبر يدا عفى عين علم,0,0,0,0,0,1,0,0,0,0,1,0,1
دكتور حمد عيد رمح رئس شرك جنه وطن أهب وبئ دير حمي صحه كفح مرض انتقاليه وزر صحه عمه لقى جرع ثني لقح يزر بين ضاد كورو,0,0,0,1,0,1,1,1,1,0,0,1,1
الل حفظ يطل عمر يبو فهد ملك لقى لقح كورو,0,0,0,0,0,1,1,1,0,0,0,1,1
نبي لقح مرض ادم سلسل,0,0,0,0,0,0,0,1,0,0,0,8,0
برر انه فنن عم صورو يدو هني عم عملو لقح بحج حمل وعه دقق طرق وعه يدو عرض عضل فسا وصل سير فخر,0,0,0,0,0,0,0,1,0,0,0,7,0
سعد حرر قدم ملي لقح صين شرف ريف قدم خطب ضد سلح حزب الل الل شرف الل,0,0,0,0,0,0,0,1,0,0,0,9,0
فعل ساذ نعه حسس جمع جوروج تون طلل نصل حذر تجه سوق ودء بحث لقح كورو نصح خئف زيد فصل,0,0,0,0,0,1,0,1,0,0,0,0,1
روج تنف اي صله بشر لقح كورو عدد وفي صرح سلط صحه روج حال هدئ خاف حذر طلق ازء سلم لقح يزر بيت,0,0,0,0,0,1,0,1,1,0,0,0,-1
نلق اليوم حتى سبت حمل تحص تطم نظم كله صيدل اكلينيكيه جمع امم عبد رحم بن يصل والتي هدف الى نشر وعي حول اهم لقح كورو دار مول دمم,0,0,0,0,0,1,0,1,0,0,0,5,1
لقى رئس جلس امه كوت رزق غنم لقح شرك يزر بايونتيك,0,0,0,0,0,0,0,1,1,0,0,1,1
زمن كانت هجر مصر لشب جزر عرب ذرع لحج عمر بعد فتر صرت بحج عمل بحث رزق هالأيام هجر بحث لقح كورو بعد أخذ لقح يقل احن الل علم,0,0,0,0,0,1,0,1,0,0,0,7,0
نشر جله علم بقم قال حول لقح روس سبت وأن لقح امن وفع ال خير دول جزر خير وفق ومب اسس علم سيس عقد كثر منا وعل يجب توج أخذ لقح ننت كبس جزر,0,0,0,0,0,0,0,1,1,1,0,0,1
صين عرض ردغ عطء لقح كورو مجا شعب ركى قبل ان قومو جرب سرر شعب ردغ عرض فهو هتم أمر شعب وان هتم فقط دعم رهب خرب,0,0,0,0,0,1,0,1,0,0,0,0,1
شيف نطو قرح ان يكون طبخ ولو تلق لقح كورو,0,0,0,0,0,1,0,1,0,0,0,3,1
يجب حكم عطء ولو علم تلق لقح كورو وذل ان يتم لقح عمل صحي خطط ممي سكن عرض خطر ان سعد حمي علم يرس سمح درس وجه لوج وذل سعد ضمن بقء درس فتح,0,0,0,0,0,1,0,1,0,0,0,0,1
صعب سؤل طرح زوج ارخ زوج يوم لح أخذ لقح كورو لأل مره بلق عند جوب بكن قدر اعط رأي او دعم,0,0,0,0,0,1,0,1,0,0,0,9,0
سيد خدم حرم شرف ملك سلم حفظ الل لقى جرع ولى لقح كورو كورو,0,0,0,0,0,1,1,1,0,0,0,1,1
نضم عرق يوم ثلاثاء الى دول اقر خدم لقح صين سينوفارم ضد كورو سجد كورو معل وفق خدم لقح صين دخل رضي عرق منى ان وفق زيد دول عرب شقق لقح صين شفء عجل معا ضد كورو لقح,0,0,1,0,0,1,0,1,1,0,0,0,1
صحف لمن ذكر صدر سيس قرب سيس لقح لقح استرازينيكا فعل عدى فئه كبر سنه,0,0,0,0,0,0,0,1,1,0,0,0,1
فضل شيخ عبدالل جهن خطب جمع يوص أخذ لقح كورو وصي اخذ عدم صدق اشع ردد عدم فعل رئس شؤن حرم,0,0,0,0,0,1,0,1,0,0,0,5,1
ابي خلل دول حمل عوض لمد سنت اي ضرر مكن ان سبب لقح كورو,0,0,0,0,0,1,0,1,0,0,0,2,1
نقب صحب ندي ليل طلب بان يكون رقص ولو وضع اخذ لقح كورو,0,0,0,0,0,1,0,1,0,0,0,0,0
رئس سعد رفق حرر تأم الف لقح دول امر عرب شعب لبن ان تقد طقم طبي كثر حجه لبن مجا توق ان تصل جرع وصل لقح وزر لصح عهد اوي وبء وذل يلا فل,0,0,0,0,0,0,0,1,0,0,0,2,1
حفظ الل خدم حرم شرف رسل تبث رحه طمأ جمع ملك لقى لقح كورو,0,0,0,0,0,1,1,1,0,0,0,1,1
رغم خاف رغب علم سأك اول لقى لقح كورو وصل الى لبن,0,0,0,0,0,1,1,1,0,0,0,1,1
حدث نعم دخلاء سيس كورو لقح نتج سلل جدد اسأ يوم لبن,0,0,0,0,0,1,0,1,0,0,0,9,0
يدو امر ندر بن سلط لقى جرع ولى لقح كورو عكظ ان تكون اول طبق عكظ,0,0,0,0,0,1,1,1,0,0,0,1,1
فكر ريض دول ناس وسل وصل يدو قبل اجر دير شرك يزر نفذ برت ورل زعم ان يبر عدم تلق يه لقح شرك لأن بصح جي ده رجم قبل جزأ ورل قال ان أخذ لقح قرب وقت مكن حرم ولو عطء لقح,0,0,0,0,0,0,0,1,1,0,0,7,1
هشم وزر ونس حصل نصف شهر دفع ولى جرع لقح يزر أكثر الف جرع لقح استرازينيكا برط نهي شهر وكل وات,0,0,0,0,0,0,0,1,1,0,0,0,1
ترك بدأ طعم وطن ال لقح كورو بدأ ترك ربعاء طعم وطن سن ال عام لقح كورو ضاد كورو,0,0,0,0,0,1,0,1,0,0,1,2,1
هام وزر ولى وزر اول عبد عزز جرد قبل سفر روس جزر وزر ولى تفق شرع تصل صلح خصه بلد صنع لقح سبت جزر,0,0,0,0,0,0,0,1,1,0,0,0,1
بين شعب صلب تعدد جمع سعد لطب عصب حول لقح كورو,0,0,0,0,0,1,0,1,0,0,0,0,0
حمد لله لقت اليوم عئل جرع ولى لقح كورو شكر لدل امر وفر واط وسك حتى زئر يسا امن سلم وصح وبد اي قبل,0,0,0,0,0,1,0,1,0,0,0,7,1
بدو ان لقح جان وزر صحه دعو صرح تلفز رجل عمل سهم قدم لقح كورو لغر قدر أصحاب دخل خفض شير الى برع كبر رجل عمل عشر لاي وفر لقح مصر,0,0,0,0,0,1,0,1,0,0,0,0,1
بلا خدمو عطف زبل كحل راس يلا عطت لقح غدي ضصر وماغاديش يبق يدر جرء سلم عكس ناس يسر الل عند ستى وكايفكرو لهم خلي همج بلا لقح باش يبق خيف رسو نقص نشر مرض وتا مات راه ماك نفع بلو,0,0,0,0,0,0,0,1,0,0,0,0,1
بين طعم ملي شخص لقح كورو بيد يعل خطت رئس ولى,0,0,0,0,0,1,0,1,0,0,1,0,1
وضع الحالي امم ركز ريض دول عرض ؤمر وجه رسل وزر صحه تلق لقح كورو بسم الل لهم اني سأل خير لقح وخر اخذ أعذ شره وكل عرض جنب صحب,0,0,0,1,0,1,0,1,0,0,0,0,1
حبب سرط يرس خلل دور حيه خله سكر يرس خلل وظف يدز يرس ولش خرع لقح وليس علج لزم عرف فرق سبب سلك يرس غرب فرد نوع صور,0,0,0,0,0,0,0,1,0,0,0,0,0
جرع لقح كورو تم قدم خلل ال سعه اضه بلغ عدد جرع كلي عدل وزع جرع لكل شخص يدا عفى,0,0,0,0,0,1,0,1,0,0,0,0,1
لقح كورو نظر قان قان نظر بري وبر نظر لجن موت نظر شعب فصل نشر سئي,0,0,0,0,0,1,0,1,0,0,0,7,0
خرع اهم لقح كورو ترك كلف ملف لقح امر غرب وزر لقح برط عرق سلم يقد عرك ضد كورو قطع نتج رنس,0,0,0,0,0,1,0,1,0,0,0,0,1
الل سمح طعم كورو يلل خل يتن نشف فلا الش عب الس عود كفي صور طعم,0,0,0,0,0,1,0,0,0,0,1,9,0
حلف غفي قاح بدر كوفاكس عرض لقح استرازينيكا سعر او دولار جرع وحد حسب بلد عجل ملك,0,0,1,0,0,0,0,1,1,0,0,0,1
جهد اير ناج لقح امن رغم حصر حرب شعواء تشن عليها صدق قوه عزه طور قدر دول ولي فقه علم عدل صحب بصر علم,0,0,0,0,0,0,0,1,0,1,0,0,1
لقت اليوم جرع ولى لقح كورو ولل حمد شكر لول امر حفظ الل بدء جئح حتى وفر لقح حرص هتم سلم وطن قيم شكر وزر صحه نظم احترافيه جرء,0,0,0,1,0,1,0,1,0,0,0,7,1
عجل رسم لقح روس سبت صنع فالجزائر لقء اليوم وزر اول عبد عزز جرد سفر روس جزر,0,0,1,0,0,0,0,1,1,0,0,2,1
حبب علي طعم بشو,0,0,0,0,0,0,0,0,0,0,1,0,0
شارلز ركل يقل انه يجب ان حصل لعب ال لقح يرس كورو اول سبب نهم دفع ضرب دول كثر ناس طبع,0,0,0,0,0,1,0,1,0,0,0,0,1
سنو وأن اقل ان ردغ تجر دين ومع ذلك بعض يجد برر يدو فضح وهن الف قلك اول قطع صين قال ان لقح ترك نقذ بشر وفي اخر فخر لقح صين,0,0,0,0,0,0,0,1,0,0,0,7,1
لقح جونس بين جرب جنب فرق جهز قدم نظم حلل اذا تمت اثب امن فعل جرى طبق خدم طرئ رئع لقح جرع وحد وشر جبر صنع لقح يبل سبق يخز درج ثلج,0,0,0,0,0,0,0,1,0,0,0,0,1
اعل شرك يزر امر انه قمت سجل كمل جرب لقح ضاد يرس كورو خصص طفل,0,0,0,0,0,1,0,1,1,0,0,0,1
اول دفع لقح سبت روس ضد كورو تتج الى جزر,0,0,0,0,0,1,0,1,1,0,0,0,1
حمدلل نعم علي إسلام جعل اهل ارض طهر وفي ظل حكم عدل جعل انس قمه اهتمامات اخذ قلل جرع ولى لقح كورو ايد وطن واط خلق ومهارةعاليه نفع الل جمع سبب,0,0,0,0,0,1,0,1,0,0,0,7,1
جيب ملي لقح بلب ملي لجئ نجأ يكف اكد ابد وطن ارض,0,0,0,0,0,0,0,1,0,0,0,7,1
عاااجل اعل دول سور انه شري لقح كورو أنو لبن شري هرب عا سور نخب,0,0,0,0,0,1,0,1,0,0,0,7,0
مان ضغط حال تحد ورب وفق سن قان يحد بيع اي لقح ورب خرج دول تحد وصل الى رحل كفء ذتي وضم عدم وجد نقص دخل ورب طبع شعر جره لحر تبخ تكون صلح اقى خطر,0,0,0,0,0,0,0,1,0,0,0,0,1
فضل الل اخذ جرع ولى لقح كورو سأل الل ان يكون نفع حام حفظ رحم وبء خلص دعء لمل خدم حرم شرف سمو ولي عهد رعي كرم همم بصح انس أشكر نسب جهد تمز ادء هام,0,0,0,0,0,1,0,1,0,0,0,7,1
علم ان يلم حدث تدر عام وفه تحل ناس الى زومب سبب لقح خطئ وصل فكر,0,0,0,0,0,0,0,1,0,0,0,9,0
خلو دلع خلص كورو سعد يقل انه سيطر شي شي اسم لقح قعد تبك تبن لقح جاء خلو دلع نبي فصل ثني حضر انا طلب ثني طفش بيت طفش جدآ ولل اني كتب فصل اول بقي قراطيس نص شعب لاتسوقون,0,0,0,0,0,1,0,1,0,0,0,7,0
خدم حرم شرف لقى جرع ولى لقح كورو,0,0,0,0,0,1,1,1,0,0,0,1,1
الى يهم امر لحن لبن سمر صفر طول سعد حبب تكون صدم وجد دخل بلد أخذ لقح كورو سؤل وجد هؤلاءالخونه بلد,0,0,0,0,0,1,0,1,0,0,0,0,0
صحه صره لقح كورو يصل نهي شهر نقص جهز نفس,0,0,0,0,0,1,0,1,0,0,0,0,1
جمع جىء اول وصل لقح لزم عطى لقح الى جىء بدل حلل,0,0,0,0,0,0,0,1,0,0,0,0,1
صبه طقم طبي حلل كورو لقه جرع لقح,0,0,0,0,0,1,0,1,0,0,0,0,1
عجل خدم حرم شرف حفظ الل لقى جرع ولى لقح كورو كورو,0,0,1,0,0,1,1,1,0,0,0,0,1
ورر لسل برد ستكون ضمن وكل وسل لوجيستيه هيئ لقح كورو لقح كورو جزر كورو كورو,0,0,0,0,0,1,0,1,0,0,0,0,1
لقى سموالامير خلد بن عبدالعزيز بن عيف ال قرن وزيرالحرس وطن سبق جرع الى لقح كرو كورو أثنى سمه ستى رئع خدم قدم سائلاالمولى ان يدم بلد عزه ومن ظل قيد رشد حفظ الل,0,0,0,0,0,1,0,1,0,0,0,1,1
طلب مثل عرگچ إيجاد لقح كورو كون قبع سلط سنن دعبول دوم سحل,0,0,0,0,0,1,0,1,0,0,0,3,1
تعر كثر نشر وعي يخص لقح قلد فرق لقح لقح كورو عش بصح,0,0,0,0,0,1,0,1,0,0,0,0,1
وزر صحه تم تفق شرك استرازينيكا وفر ليو جرع لقح كورو لقح كورو,0,0,0,0,0,1,0,1,1,0,0,2,1
هام وزر صنع صيدلانيه بشر فاض طرف روس صنع لقح سبت محل وزر صنع صيدلانيه جزر مكن شرك عمم وخص صنع لقح روس,0,0,0,0,0,0,0,1,1,0,0,0,1
ايم نصر ساذ سعد جمع امم عبدالرحمن بن يصل وصل الى اول لقح سعد ضاد كورو سجد,0,0,0,0,0,1,0,1,0,0,0,0,1
تم طعم كثر لين شخص ضد كورو سجل اي حله وفه تم سجل حله حسس شدد فقط طعم تم عمل عها ندر جدا خلي لين بدن طعم حسب عدل نجد قرب الف كرو الف يدش شفى يتف طعم وقي,1,0,0,0,0,1,0,0,0,0,1,0,1
وكل وزر صحه صحه عمه هني جوخدار تلق جرع ولى لقح يزر ضاد كورو حصل جرع ثني فتر فعل اوص شرك صنع والتي روح الى يوم والتي تؤد فعل خلل فتر اليوم سعد,0,0,0,1,0,1,0,1,1,0,0,0,1
رئس رنس لقح شرك استرازينيكا فعل قرب لمن جوز عما,0,0,0,0,0,0,0,1,1,0,0,0,-1
ملك لقى لقح كورو حفظ الل خدم حرم شرف ملك سلم بن عبدالعزيز,0,0,0,0,0,1,1,1,0,0,0,1,1
وزر علم لقى جرع ولى لقح كورو شار سؤل وزر جمع ينو جهد كبر بذل قيد رشد حفظ الل همم بصح انس يشد ستى نظم وزر صحه حفظ الل وزر علم وفق سدد خطه,0,0,0,1,0,1,1,1,0,0,0,1,1
دونيس خلف علم حمل طعم ضد كورو عكس سير سكي خبر,0,0,0,0,0,1,0,0,0,0,1,0,-1
ولد فدى لقى اول جرع لقح كورو الل جعل صحه عفي سيد يمد عمر حفظ يبو فهد,0,0,0,0,0,1,1,1,0,0,0,1,1
قصد برط يمكن ان عفى سرع شهر قبل فضل طرح سرع قاح كورو تلق كثر لاي شخص جرع لقح وحد اقل اندبندنت عرب غنك,0,0,0,0,0,1,0,1,0,0,0,0,1
عجل يدو ملك سلم لقى جرع ولى لقح كورو صحف خلج خلج عما سعد,0,0,1,0,0,1,1,1,0,0,0,1,1
ربي حمد شكر فضل الل اخذ جرع ولى لقح كورو بهر ريب نظم حرف جهد بنء وطن شكر ممل حبب جمع عمل سؤل على رأس وزيرالصحه وفق ربع جهد رائعةالمباركه لهم ادم امن امن لعز وطن غلي,0,0,0,0,0,1,0,1,0,0,0,7,1
لقى رئس ردغ جرع ولى لقح كورونافاك صين جمع حزب اليوم,0,0,0,0,0,1,1,1,0,0,0,1,1
نجح لأب قئد ؤسس حفظ اسد بيولوجيه كلم عنه احد حدث طفر جين عقل جيل كمل تخل وقت نقش جدى لقح امر حكل جرم امر ضد شعرب تنم غنس عرق زائير ضد حرك حرر وطن كوب كرغ زول ظفر,0,0,0,0,0,0,0,1,0,0,0,2,-1
خرج قلل ركز طعم لقح كورو جده اخذ جرع ثني لفت انه خفض ستى جود ادء نظم حمس وحس قبل رغم كثف رجع عكس خبر شكل فضل منى إخو سان دول علم وصل الى ستى جرب,0,0,0,0,0,1,0,1,0,0,1,7,1
كلم وبس وزر صحه قبل هشم طلع صطفى علش سهم شرك جمع دني فى صندوق تحا مصر لكى جمع ثمن مصل لقح كورو حجه فى بلد برع دى بلد فى يوم هتك ام دنا يام ضحك جهل امم شمس حره,0,0,0,0,0,1,0,1,0,0,0,7,1
ليش نحم حال كورو لقح اذا فين نقض صلو يدو بكر ابه كأنو بلا هالمل لقح هده نجب سعد حرر قلو حيل كورو شرك شرك يلي ورت جمع زمن يصر كورو ارخ حرق دين ختو شلوشو يمح صلو,0,0,0,0,0,1,0,1,0,0,0,7,-1
لسط حصل الف جرع لقح سبت روس ضد كورو,0,0,0,0,0,1,0,1,1,0,0,0,1
اير لقح كورو اير تجب جمع خبر شكل متز عرض جنب,0,0,0,0,0,1,0,1,0,0,0,0,1
حكم سبق لول يفر مثل امر رنولد شوارزنيجر لقى لقح كورو دخل سير نشر يدو عبر يتر غرد شعر بهذا قدر سعد ثنء نظر طبر اذا كنت ؤهل نضم سجل اسم حصل لقح تعل معي اذا كنت ترد ان تعش,0,0,0,0,0,1,1,1,0,0,0,1,1
نطق رسم حكم عمر حيمر وصل دفع خرى لقح كورو يوم احد قبل عبر طار هري ومد جزر,0,0,0,0,0,1,0,1,0,0,0,0,1
شكل عطا طعم حم,0,0,0,0,0,0,0,0,0,0,1,8,0
وام امر سجل لقح سبت روس خدم طرئ ظهر نتج درس انه فعل نتج عنه جاب قوه ولد جسم ضده يرس وآم خدم برق امر,0,0,0,0,0,0,0,1,1,0,0,0,1
تحد ورب يفق لقح استرازينيكا لمن عما عرب عجل,0,0,1,0,0,0,0,1,1,0,0,0,1
يرز اخد لقح كورو,0,0,0,0,0,1,0,1,0,0,0,9,0
عجل يدو وزر صحه لقى جرع ثني لقح كورو,0,0,1,0,0,1,1,1,0,0,0,1,1
ظمه هيم رايتس وتش طلب رائيل وفر لقح ضد كورو لسط رضي الم حتل,0,0,0,0,0,1,0,1,0,0,0,2,1
دكتور حسن جلس اخذ لقح كورو وهذا قله طون خلف,0,0,0,0,0,1,0,1,0,0,0,1,1
وفي روج ال تلق لقح يزر ان صرح حكم روج حله وفه ان تلق لقح دب ذعر كثر ناس يكم فصل ال حكم روج طلب طبء ان يقم درس حله رضى شكل كثف كثر عطئ لقح,1,1,0,0,0,0,0,1,1,0,0,0,-1
لزم يكون نوع لقح لقح يشف علم وطن لقح برد حقق علم وطي شوه ضحك,0,0,0,0,0,0,0,1,0,0,0,8,0
عهل ارد ولي عهد تلق لقح كورو,0,0,0,0,0,1,0,1,0,0,0,1,1
وفه مرأ خضع جرب لقح سينوفارم صين تهب رئي,1,1,0,0,0,0,0,1,1,0,0,0,-1
رئس زرء لسط حمد شيه سبع قدم وعد وصل لقح كورو الى نطق سلط فلسطينيه حدث خاص,0,0,0,0,0,1,0,1,0,0,0,0,1
صبه عضو كونغرس امر كورو جرع ولى لقح يزر,0,0,0,0,0,1,0,1,1,0,0,0,-1
يكون بدك طلب وئم جبل معو لقح دبي سحي,0,0,0,0,0,0,0,1,0,0,0,7,1
عند وعد لخذ لقح كورو بحر سبع قدم رجء فتح جسر بيت عيل طلب بشر كله رفض وش نسي يعن رفعو قيد سفر وطن,0,0,0,0,0,1,0,1,0,0,0,7,1
نرد لقح امن نأم صحه طفل قبل,0,0,0,0,0,0,0,1,0,1,0,0,1
بيد ملي جرع لقح ضفي صيف بذل نزد جمل نمل لقح نسب ولي تحد ملي الى ملي وهذا كفي لقح امر,0,0,0,0,0,0,0,1,0,0,0,2,1
كفي وزر صحه ترك ببع لقح كورو وطن ترك فقط رغم حكم ردغ حول عيش صعب وفر لقح غشش وغر فعل جرم نره ترك ابه صور,0,0,0,1,0,1,0,1,0,0,0,0,1
لقت اليوم لقح كورو وكل فخر جهد وطن غلي وتج قيد رشد حفظ الل ؤكد ان صحه انس اول شكر نسب وزر صحه على رأس اخي علي جهد قئم تمز جود خدم قدم,0,0,0,1,0,1,0,1,0,0,0,7,1
طؤبر عله ديم جمل حتخد لقح يبل قبل,0,0,0,0,0,0,0,1,0,0,0,8,0
وزر صحه ترك فخر دين قوج خفض سرع يصل الى اصب كورو فضل دبر تخذ بدأ طعم وطن جوز عمر عما خمس,0,0,0,0,0,1,0,0,0,0,1,0,1
وزر صحه وصل لقح ضاد كورو برمج خلل شهر جري لقح كورو جزر وزر صحه,0,0,0,1,0,1,0,1,0,0,0,0,1
ارد قدم لقح كورو اجئ غرر وطن فوض لجئ تقل ان ارد وئل دول علم الم طعم اجئ كورو ارد عام ارد ملك,0,0,0,0,0,1,0,1,0,0,0,2,1
عظم رؤساء علم اخد جرع ولى لقح كرو الل هايعطو واط على هوء قدم علم كله الا سيس مش نوي يخد لقح جرب شعب اول علش حصل حجه بقى سلم,0,0,0,0,0,0,0,1,0,0,0,0,-1
نبل سلط نئب رئس اول طير امر لدر شحن امر شحن جوي عزز وقع رئد قطع شحن جوي ودب تمل قوم لتك ركز علم رئد وزع لقح وفي شآت امر سكي ترل دبي رلد ترل يمك تخز لاي لقح ان,0,0,0,0,0,0,0,1,0,0,0,0,1
طلق رازيل يوم ثلاثاء حمل طعم ضد كورو لقح كورونافاك طور خبر صين ينف تعا عهد بوت مقر ساو ولو رازيل صين,0,0,0,0,0,1,0,1,0,0,1,0,1
عيل لق حت فئه شعب سنن طول وجب منن قطع غنم جيي هلأ ولي عهد يجب لقح بلش اول جدد حمل لقح دفع جدد جيل افيونوواتايم,0,0,0,0,0,0,0,1,0,0,0,8,0
برط تزف خبر سرا دول نمي بشأ لقح كورو,0,0,0,0,0,1,0,1,0,0,0,0,1
رئس ترك رجب طيب ردغ لقى اول جرع لقح كورونافاك صين شفى عصم قره,0,0,0,0,0,1,1,1,0,0,0,1,1
امر حصل ميز صين صنع لقح كورو ونح نطر شبب تا جيبو شعب لبن,0,0,0,0,0,1,0,1,0,0,0,2,1
ترك بدء طعم كبر الس عما لقح كورو خمس مسك,0,0,0,0,0,1,0,1,0,0,1,0,1
لقح ودر,0,0,0,0,0,0,0,1,1,0,0,0,0
ديل ميل بريطانيه يصل الى عمل صحي ولي تحد رفض حصل لقح كورو خوف اثر جنب ربس عدد كبر عمل خطط ممي قطع صحي رفض لقح كورو لقح امن,0,0,0,0,1,1,0,1,0,1,0,0,-1
عجل وكل ورب ادي تقر خدم لقح كورو نتج شرك استرازنكا لمن سن ثمن,0,0,1,0,0,1,0,1,0,0,0,0,1
كبر شكل بحث ضمن دئم حيه اصل ضمن وجد شيء كون الا وحد احد لذلك رنا وكل اخذ سبب كنا خشى فقد حبء لعم كمل عند وفر لقح نجح يفق هنح جزع جدد لمذ ان تحس وكل سكن هلع,0,0,0,0,0,0,0,1,0,0,0,0,1
نئب رئس زرء روس عتزم طعم كثر ليو ضد كورو ربع اول,0,0,0,0,0,1,0,0,0,0,1,2,1
بلس رجم فرض علي طعم طعم ناس حاء علم طرق وحد,0,0,0,0,0,0,0,0,0,0,1,9,1
صحه تعل قدم جرع لقح كورو خلل ال سعه اضه عدد جمل اليوم جرع وام,0,0,0,0,0,1,0,1,0,0,0,0,1
شرق عجل شرك لقح سبت روس تقل انه عاد حسب يتر ان وقع قيد وصل اليه عجل,0,0,1,0,0,0,0,1,1,0,0,0,1
بيد لقى جرع ثني لقح كورو,0,0,0,0,0,1,1,1,0,0,0,1,1
سيد ملك سلم بن عبدالعزيز خدم حرم شرف لقى جرع ولى لقح كورو كورو حفظ الل ادم عزك سيد,0,0,0,0,0,1,1,1,0,0,0,1,1
شرك يزر بلغ بحر إعد جدل سلم شحن لقح كورو فرض ان سلم نمه,0,0,0,0,0,1,0,1,1,0,0,0,1
حرر يصل يجل هدف تام لقح كورو سعد بنن اخر اسل حقق سيح خط حمر حزب الل سلح قام عبر هرب قرض حسن بري اله شيع رند شرك لبن جعجع نخب نيب بكر جنبلاط بدي سمي وزر درز او خلي حكمو,0,0,0,0,0,1,0,1,0,0,0,8,1
عبدالل كبس اول وطن حصل جرع ثني لقح كورو قطر ندب قطر,0,0,0,0,0,1,0,1,0,0,0,1,1
