text,feature0,feature1,feature2,feature3,feature4,feature5,feature6,feature7,feature8,feature9,feature10,category,stance
بيل غيتس لقى لقح كورو صور ابر رنج دوء لبس ولو صيف عز شتء يقل ان حدى مزا عمر ال عام انه ؤهل حصل لقح عنى حاج لقح عمر صغر,0,0,0,0,0,1,1,1,0,0,0,1,1
وزر صحه لحد اليوم حدد هلأ ؤمر صحف عند شكل عوا انا يزر لقح وحد امن علم لأ حبب هاي نفق وضح عفا يعن مش انا جبر قدر جبر دول ارق دفع صري تجب لقح تني يلا باي,0,0,0,0,0,0,0,1,1,0,0,0,1
قول رح كونو اد سؤل لبن وصل لقح الف جرع لقح كورو تلف شفى وسط لأن عمل نظف وقف طرق خطأ عمل ثلج حفظ لقح كورو,0,0,0,0,0,1,0,1,0,0,0,0,1
ترك وزر صحه فخر دين قوج لقى اول جرع لقح كورونافاك صين شفى عصم قره,0,0,0,0,0,1,1,1,0,0,0,1,1
وئم وهب شتم دول خلج طله علم تسف علي يوم جاء الى دبي أخذ لقح كورو جدر وقف طرد اذا سحي فعل شئت,0,0,0,0,0,1,0,1,0,0,0,7,0
لقح كورو امر قلق زايد وزع عدل,0,0,0,0,0,1,0,1,0,0,0,0,0
لبن شرى لين لقح امر اذا شلن يلي عمر سنه ويل ابد يخذ لقح امر ويل دهم يخذ لقح لنه فكر ؤمر عتقد فضل لقح عشا عمل قصه مين رح يخذ اول شي بكر ذكر دول رح تصر تدع لخذ لقح ناس بده,0,0,0,0,0,0,0,1,0,0,0,0,1
عرض لقح كورو هكر حسب عتويتر عصي حلا,0,0,0,0,0,1,0,1,0,0,0,7,0
مليونيرا لبن رضت ضرب ثرا نج انفوغراف دعم ؤسس كسفام حرب فقر حرب لامساواه يرس لامساواه لقح ناس لبن نفض,0,0,0,0,0,0,0,1,0,0,0,8,0
دعبول حضر منو انت طلب قئد دول سلم لقح لعد تبع خبر بكل جلا تفق ورح طلع لقح قرب دعبول دوم سحل,0,0,0,0,0,0,0,1,0,0,0,0,1
مات شخص روج تلق لقح كورو وير بوس,0,0,0,0,0,1,0,1,0,0,0,0,-1
بنء حلل لهذ بين قرر ملك تحد أجل جرع ثني واستخدام جرع تحه طعم كبر عدد مكن ناس لحن صنع يكف لقح وفر جرع ثني خلل مده تصل الى سبع لقى جرع ولى وحذ دول حذو,0,0,0,0,0,0,0,1,0,0,1,0,1
حراموس ولي نفع لقح شيت كبببر سعد موت يرس أخذ طعم لقح امر,0,0,0,0,0,0,0,1,0,0,0,0,-1
اعل هام وطن قيم دول قطر وزر صحه عمه فتح باب سجل حصل لقح كورو عبر ربط تلي قطر ندب قطر,0,0,0,1,0,1,0,1,0,0,0,0,1
صين ثنء ظهر سلل جدد كورو ام اسن لمر طاع ناج لقح لهذ سلل بهذ سرع شرو دول ولا سلل جدد ستأ لعض,0,0,0,0,0,1,0,1,0,0,0,0,1
بنك دول نؤم لقح يزر الف شخص لبن,0,0,0,0,0,0,0,1,1,0,0,0,1
مصر صحه طلق وقع طلب حصل لقح كورو جرب,0,0,0,0,0,1,0,1,0,0,0,0,1
حذر رئس خطر طعم طعم خطر أضف ماجوفولي طاع علماء خرع لكن وصل الى لقح ضد يدز سرط لسل فتر طول وحث رئس ماجوفولي تنز وصل تخذ حيط وقت نفس اعل انه يكون حجر صحي بلد,0,0,0,0,0,0,0,1,0,0,1,0,-1
علي دكتور وزر صحه يبن انه يمكن لمن لقى جرع ولى لقح يزر بين ان لقى جرع ثني لقح استرازينيكا يقل ان دلل اول فيد بأن سلل جدد كورو تجب علج لقح خلف الم نعه كورو,0,0,0,0,0,1,1,1,1,0,0,2,1
لقح حصب منع صبه حصب لقح جدر منع صبه جدر لقح كوذيب منع صبه مرض منع نقل عدى يجب رار كتم فاس وأن بعد ناس فعل جرب لمذ يتم سمت لقح ضلل ناس ان عمت بصر,0,0,0,0,0,0,0,1,0,0,0,8,0
خدم حرم شرف حفظ الل لقى جرع ولى لقح كورو كورو,0,0,0,0,0,1,1,1,0,0,0,1,1
يهو لقى جرع ثني لقح كورو,0,0,0,0,0,1,1,1,0,0,0,0,1
يجب ان يكون لقح كورو شمل جمع لنك وضح ان حمي بلد ثره وحد يتح عود حيه الى طبع وطل ظل كورو نشر اي كان علم يظل شكل هدد جمع يجب ان عمل معا كأمم تحد لقح فعل,0,0,0,0,0,1,0,1,0,0,0,0,1
طار قهر قبل شحن بلغ الف جرع لقح استرازينيكا صنع هند,0,0,0,0,0,0,0,1,1,0,0,0,1
اذا لبد لزم سؤل رسم دول لبن خصه رؤس وزر حصلو لقح كورو شعب مش خدم شعب او انا غلط اذا صح علم حول حصل هالفئ عاللقاح غير يعن فعل وقح بتك تخط حدد الك عملو نظر ناس تجه نظر حقر,0,0,0,0,0,1,0,1,0,0,0,7,1
عجل يدو ملك سلم لقى جرع ولى لقح كورو,0,0,1,0,0,1,1,1,0,0,0,1,1
لأن علم انه لقح امن وضع عقب شرك تقم ركب ولأ علم ان اير بأم انس نفس وضع عقب عتب رضي قدس امر شيط كبر,0,0,0,0,0,0,0,1,0,1,0,0,1
حمدلل اخذ جرع ثني طعم كورو الل عفي سلم وبء,0,0,0,0,0,1,0,0,0,0,1,7,1
مخض وزر صحه أنجب لقح انت وحظ تقل يرب ترح عند واح مالناش دخل بدن وسط,0,0,0,1,0,0,0,1,0,0,0,7,0
حسب الل نعم وكل شكل حيعطو لقح جمع ولي يعز علي عند غدر ملك زي ادي الي هرب اثر يزن حق صحه ماتنصرف وطن سشف بلد عشن يزن اكف,0,0,0,0,0,0,0,1,0,0,0,3,0
اير علق يرد الف جرع لقح يزر قرر خامنئ منع يرد لقح,0,0,0,0,0,0,0,1,1,0,0,0,1
لجن طرئ رئس رئس زرء نقش وفر لقح كورو يمن سبأ نت,0,0,0,0,0,1,0,1,0,0,0,2,1
بيد لقى جرع ثني لقح كورو,0,0,0,0,0,1,1,1,0,0,0,1,1
درس لقح يزر يزد رغب الل حس صحف جلجوء,0,0,0,0,0,0,0,1,1,0,0,9,1
ترك وصل دفع ثني لقح كورونافاك صين,0,0,0,0,0,1,0,1,0,0,0,0,1
نئب عام سعد عجب لقى جرع ولى لقح كورو اليوم عرب شكر عمق قيد رشد سرع وفر لقح وطن قيم ؤمل نهء جئح قرب فضل الل فضل جهد خلص وزر صحه بتج خدم حرم شرف ولي عهد حفظ الل,0,0,0,1,0,1,1,1,0,0,0,1,1
وزر صحه ضرر إجراء فحص جسم ضده اخذ لقح عجل كورو ارد لقح كورو ملك,0,0,1,0,0,1,0,1,0,0,0,2,1
دكتور حمل شهر ثمن ولي تحد امر خذت طعم كورو ان صرح حمل حال لكن قلت بسط احم نفس ولل بطن فضل اني اكن حمل اصب كورو ونت ويه ربع تدخ يوم تخف طعم خذ طعم نشر اشع خطئ,0,0,0,0,0,1,0,0,0,0,1,0,1
نحن ندل عنا بدو يكون عنا لقح كورو تك كير بيب سوا,0,0,0,0,0,1,0,1,0,0,0,0,1
يدو علي دكتور حمد بن حمد سعد وزر صحه لقى جرع ثني لقح كورو جمع وشر خصص,0,0,0,0,0,1,1,1,0,0,0,1,1
ظمه دول علم وشك فشل خلق وزع لقح كورو,0,0,0,0,0,1,0,1,0,0,0,0,1
ان وعد علم لقح ركى صنع قدم بشر ردغ لقى لقح صينى ازى صحه بقى,0,0,0,0,0,0,1,1,0,0,0,1,1
قئد على قوت جوه سبن تقل صبه تهم حصل لقح كورو ان يحن دور مش عم مزح,0,0,0,0,0,1,0,1,0,0,0,0,1
لقح كورو يزر بين عمد وزر صحه حصر سيس حرم جرم لقح ودر امر طبء لقح كورو صين سبب غيبوب دئم سيس صري امر عطى شعب صري وهذا بدأ اي قلب شيء جيد حكم وشل سيئ قتل شعب,0,0,0,1,0,1,0,1,1,0,0,0,1
شار رئس صحه ؤكد عقد رسم ملي جرع لقح ضد كورو,0,0,0,0,0,1,0,1,0,0,0,2,1
هنغار وقع عقد قنء لقح سبت روس ضد كورو,0,0,0,0,0,1,0,1,1,0,0,0,1
ترك وزر صحه لقى ولى جرع لقح كورو صين,0,0,0,0,0,1,1,1,0,0,0,1,1
وظب امر تعل وفر لقح كورو جمع بدء سن عما,0,0,0,0,0,1,0,1,0,0,0,0,1
يرس نهي اهم وجد طعم فعل ضد كورو وام برق امر,0,0,0,0,0,1,0,0,0,0,1,0,0
نول زغب لقي لطف دبي وضح حقق تلق لقح كورو,0,0,0,0,0,1,0,1,0,0,0,1,0
صور تغن الف كلم حفظ الل خدم حرم شرف ورع شكر قدم دعم بدي جئح حرص سلم وطن قيم علج حصل لقح مجا أمر بذل غلي نفس اجل صحت الل يطل عمرگ ملك لقى لقح كورو,0,0,0,0,0,1,1,1,0,0,0,1,1
رائيل كشف فعل لقح كورو تثر سئل حول استراتيجيه بريطانيه اندبندنت عرب غنك,0,0,0,0,0,1,0,1,0,0,0,2,1
فتر كورو رار رتب حكم دعم قطع خاص وطن قيم وفر ؤون عدم قطع علج مجا قيم وطن تلق لقح مجا قيم وطن دول سوت نفس حمدلل حكم قيد حمدلل سلم ولد ملك لقى لقح كورو,0,0,0,0,0,1,1,1,0,0,0,0,1
نطق بعد كيد دول لبن عطء لقح كورو اجئ سور لسط غير سبب كظظ سكا ضمن خيم صعب يطر يرس حال نشر ضفه الى عدم وفر دنى سبل وقي لدي لحد نشر,0,0,0,0,0,1,0,1,0,0,0,7,1
شكر نعم وجد دول سعى تأم لقح لكف وجد ارض نهي عام دعو نسى قرء لقح كثر مئه دول حصل اي دفع إلى ان يتم حوء وبء علم تهو جرء وقي لقح قطر تزم كمم كورو,0,0,0,0,0,1,0,1,0,0,0,7,1
فضل عقر كورو عقر للى انت سكن وحس لقح كورو انك لقح فى عقر,0,0,0,0,0,1,0,1,0,0,0,7,0
ربط طبء غزي عنتاب عدد طبء سور عمل ركز صحه تبع وزر صحه ركه غزي عنتاب تلق جرع ولى لقح كورو,0,0,0,0,0,1,0,1,0,0,0,0,1
عهل سعد لقى لقح كورو يدو رصد حدث عجل,0,0,1,0,0,1,1,1,0,0,0,0,1
نئب حزب ديمقراطي امر اري نيم طلب يهو وفر لقح كورو سرى لسط ردا قرر حكم ثنء رنمج لقح نيم سبق ان صدر وقف نهض سيس سيط حصر غزه جرم حلل ضد لسط,0,0,0,0,0,1,0,1,0,0,0,3,1
زمن جمهور سلم يرن عظمى بدء قوه يمن علم ملك الى قوه عسكر الل تنه الى قوه لحب زرع قلب حرر علم علم نظر بشر فرج ات حله لقح امن,0,0,0,0,0,0,0,1,0,1,0,8,0
نظم نظم هنه بشش جهد وزر صحه جبر ظهر وضح خلل لمح رضى بسم رسم لمح تلق لقح كورو,0,0,0,1,0,1,0,1,0,0,0,0,1
سيأ دول امن لقح امن,0,0,0,0,0,0,0,1,0,1,0,0,1
فضح عير ثقل سيد وكل فضح خطه نظم سيس وزع لقح يزر سؤل لقح صين شعب ملف كمل,0,0,0,0,0,0,0,1,1,0,0,2,1
اعل تعل دره درس تمثل مرض صحه درس بدأ طعم طلب لصف سدس ضد مرض تنس ديفتير رجى حضر فئه هدف درس يوم ثلاثاء خلل فتر دوم درس تقد طبق بروتوكول صحي لحد نشر كورو,0,0,0,0,0,1,0,0,0,0,1,0,1
درس لقح يزر بدو فعل كورو تحر,0,0,0,0,0,1,0,1,1,0,0,0,1
عجل درس طبه جمع كسس امر ؤكد لقح يزر فعل ضد سلل تحر كورو ظهر برط جنب فرق امر,0,0,1,0,0,1,0,1,1,0,0,0,1
وطن عمر عام لقى لقح كورو عمد امر,0,0,0,0,0,1,0,1,0,0,0,7,1
بشر الأ وصل طئر عسكر الى طار وفر والتي متن اول دفع لقح سبت قدم عصم روس وسكو,0,0,0,0,0,0,0,1,1,0,0,0,1
بسق عالغبيري لاق قاح كورو لبن حقن زوم سرد وها عيش شكل طبع,0,0,0,0,0,1,0,0,0,0,0,7,1
شرق عجل قال نصف سلو رئس فرق بيت ابض كلف طور لقح كورو عجل,0,0,1,0,0,1,0,1,0,0,0,0,0
لقح يزر بيو وفق لبي شرك يزر نشر لقح فعل نسب قرب جرع ولى,0,0,0,0,0,0,0,1,1,0,0,0,1
امر سعد يجب تهم حصل وسط تلق لقح ضاد كورو,0,0,0,0,0,1,0,1,0,0,0,0,1
فضل عقر كورو عقر الي انت أحس لقح كورو انك لقح نفس عقر وقي,0,0,0,0,0,1,0,1,0,0,0,7,-1
اهم یقدم وقع جهد خلق یرنی ینیر اير عقب لقئ عدم شرء لقح كورو كورو وزر خرج امر درج حوث يمن ثلث قدت قئم رهب عمل عدم عدم سجي سيس اير عام,0,0,0,0,0,1,0,1,0,0,0,0,0
لقح كورو كنس جلتر تهم تحد ورب خلف سيح ربط تخط حجب زيد,0,0,0,0,0,1,0,1,0,0,0,8,0
عجل رئس امر جو بيد عمل طعم ملي شخص لقح ضاد كورو خلل مئه يوم ولى فتر رئس وجه حكم ولي وكل فيدراليه نسق شرك واج جئح كورو أوقع اعل نفذ عوض ولي سبب دعي كورو,0,0,1,0,0,1,0,1,0,0,1,2,1
عجل رنس توص باستخدام لقح استرازينيكا ضاد كورو لمن اقل عما فقط,0,0,1,0,0,1,0,1,1,0,0,2,1
عضو لجن وبئ عزم حفظ ملك حمل رضع لتي خطط حمل سثن اخذ طعم كورو عجل ارد حكي عام ملك,0,0,1,0,0,1,0,0,0,0,0,0,1
حكم وصل الف جرع لقح استرازينيكا فى كورو فصل,0,0,0,0,0,1,0,1,1,0,0,2,1
كامال هاريس تلق جرع ثني لقح كورو,0,0,0,0,0,1,0,1,0,0,0,1,1
هدء للد وقد ملك لقى لقح كورو برد سلم رب جعل نفع عمر ديد يدم سنه ملك سلم حرف بصت علي شيب,0,0,0,0,0,1,1,1,0,0,0,1,1
ملك لقى لقح كورو لحظ مده قطع ثني فقط رقب سعت مرت وهن قعد تحث دقه تقل ضبط سعت مواعيد سلم لأن عرف ان امر ريض بدق مواعيد وإهتمامه وقت لهم حفظ بعن تنم,0,0,0,0,0,1,1,1,0,0,0,1,1
بيل غيتس يجب الا نعد كنا رغم انن سيك قدر صنع لقح سرع فضل قنه جدد وجد لقح يزر علي ان نكن سعد وبء قدم نرد ان ثمر فحص وفي فرق كامل نسم فرق طفء وبي ذهب وجد وبء جدد,0,0,0,0,0,0,0,1,1,0,0,0,1
علق دير ظمه صحه علم كثر ملي جرع لقح تم عطؤ يقل دول دخل رفع وهن جرع فقط اعط احد بلد دخل خفض لمل كوفاكس وال لير لقح تبع قرء هيك,0,0,0,0,0,0,0,1,0,0,0,0,1
شرق عجل مصر منح رخص طرئ لاستخدام لقح كوفيشيلد استرازينيكا عجل,0,0,1,0,0,0,0,1,1,0,0,0,1
صبه شخص شلل فى وجه تلق لقح كورو بإسرائيل,0,0,0,0,0,1,0,1,0,0,0,0,-1
خبر سعد علم خبر بايونتيك بين رسم لقح كورو يزر متع فعل ضد سلل بريطانيه جنب فرق كورو تحر رسم خوف بإذ الل أخذ لقح اي سلل كورو,0,0,0,0,0,1,0,1,1,0,0,0,1
تصل جزر روس صنع لقح سبت جزر,0,0,0,0,0,0,0,1,1,0,0,0,1
وزر اول وسط وطن قدم تلق لقح سبت روس,0,0,0,0,0,0,0,1,1,0,0,1,1
يزر وقع بيع بقم لير لقح كورو,0,0,0,0,0,1,0,1,1,0,0,0,1
صحه ظهر حله حصن جوز صحي طبق وكل تلق جرع ثني لقح كورو وطن كثر,0,0,0,0,0,1,0,1,0,0,0,0,1
صور كرم خدم حرم شرف ملك سلم بن عبدالعزيز بلغ كلم وهي قطع يشك خدم لقح ملك تلق لقح كورو عمد قاعد حسن شهر حدث,0,0,0,0,0,1,0,1,0,0,0,0,1
قرب تلق جرع ثني لقح يزر سبع جرع ثني اتت نتج فحص يجب لقح بدأ عمل ضد كورو وخر ابع حمل,0,0,0,0,0,1,0,1,1,0,0,7,1
درس لقح يزر بين فعل ضد كورو تحر,0,0,0,0,0,1,0,1,1,0,0,0,1
يدو وفه شخص تلق لقح كورو روج سبب,1,1,0,0,0,1,0,1,0,0,0,0,-1
لقح بنا اول امس مشاهير عند تسل لقح يوم صرت اول شلن,0,0,0,0,0,0,0,1,0,0,0,7,0
حمدلل اخذ شوي جرع ثني لقح كورو الل نفع يرب ولل يعز دول حكم شيء قدمو,0,0,0,0,0,1,0,1,0,0,0,7,1
اعل رئس بلد ابي بين ان دين كتي حصل ملي جرع لقح استرازينيكا كورو,0,0,0,0,0,1,0,1,1,0,0,0,1
لقح بنا اول ردا كمه فرغ عنصر هاشتاغ انا لبن برع لقح دفع لجى رضي لبن ذوي مرض زمن يتم لقح دفع مين سعد حدد فيد,0,0,0,0,0,0,0,1,0,0,0,7,1
يدو واس سفر امر ملك عقب لقه لقح كورر كورو ؤكد جمع امر ان لقح امن فعل نظم كفء سعد شهد اليوم كنا غيه روع نعد حذر واس عام,0,0,0,0,0,1,0,1,0,1,0,1,1
هرل حكم عرق لقح يزر امر امر دول لحد تصد علم اصب خطه شبه خلف صلح امر كسب مال أطراف حكم فسد شري جرع أسعار ضعف شري بقي دول الل قاح نرد لقح امن,0,0,0,0,0,0,0,1,1,1,0,2,1
دول شعب هيج برح لان وحد شفي ورا لقح ستف بقه لقح ال يزر لزم خدم خلل ايم ذوب مهم فه جنت حتخلص ال ايم بذج ليل فبو شفى لقح كريب عمل ضمن جهل ثنن كتب رسل عذر يبه جان حيروح زبل,0,0,0,0,0,0,0,1,1,0,0,0,1
رئس ديب رأس جمع لجن وزر تبع خطه لقح وبء كورو صرخ ناس فهم سمع ونح بحج صبر ايم عدد بدأ لمس نتج نرد هدر قفل قرر تسر عه,0,0,0,0,0,1,0,1,0,0,0,0,1
روس تعل ان لقح كورو ثني عهد كور فعل نسب عجل كورو ملك,0,0,1,0,0,1,0,1,0,0,0,0,1
جزر عمل ناج لقح سبت طلق ابع قبل,0,0,0,0,0,0,0,1,1,0,0,0,1
نئب امر ريض لقى جرع ولى لقح كورو,0,0,0,0,0,1,1,1,0,0,0,1,1
ابو هشم برع ملي هوء بدئ صندوق تحا مصر وفر لقح كورو يدو,0,0,0,0,0,1,0,1,0,0,0,0,1
تحد ورب يفق لقح استرازينيكا ضاد كورو لمن عما,0,0,0,0,0,1,0,1,1,0,0,2,1
قدم امر كثر لاي الف جرع لقح كورو الل حفظ وطن مجهوداتك خرت طعم يدا عفى,0,0,0,0,0,1,0,1,0,0,1,2,1
عجل لقى خدم حرم شرف جرع ولى لقح كورو كورو يدا عفى عين علم,0,0,1,0,0,1,0,1,0,0,0,0,1
قره ردغ لقى جرع ولى لقح كورو فصل,0,0,0,0,0,1,1,1,0,0,0,1,1
عند نزل دجل سيك كتب جبن كفر ومع تبع خلق كثر بد ان ناس حين عرض سحر او ربم لقح نوع,0,0,0,0,0,0,0,1,0,0,0,7,-1
بشر ريد علم وطن عهد بحث طبه جمع امم عبد رحم بن يصل طقه شرق وصل الى لقح ضد كورو قيد ايم نصر دكتور هندس طبه حيي قنه ثقت هذااللقاح كبر غير نفء نفس جري عدم سرع اعل عنه,0,0,0,0,0,1,0,1,0,0,0,0,1
قلت شتقتل اخد ليك ليش شو شو شو عمل حيه ثلا لقح كورو اخد هلقد,0,0,0,0,0,1,0,1,0,0,0,8,0
لله حمد لقت جرع ثني لقح كورو نسب وزر صحه بنء بنت وطن سحق شكر قدر حسن نظم عمل رقي خلق رفع حمد شكر لله كرم بوط قدم انس شيء وطن فرق وطن قيم خلف,0,0,0,0,0,1,0,1,0,0,0,7,1
صحه تعل قدم جرع لقح كورو خلل ساع ال اضه عدد جمل اليوم جرع وام,0,0,0,0,0,1,0,1,0,0,0,0,1
وفه شخص تلق لقح كورو سلط صحه ورب تنف علق أعراض طعم عرب اليوم,1,1,0,0,0,1,0,1,0,0,1,0,-1
اوك انا بغي ولد بغي تزج مكن منديرش لقح,0,0,0,0,0,0,0,1,0,0,0,8,0
سرو انت بقى طعم جرع لقح يزر كبر حاخام تل ابب يصب كورو دهش ان شرك نجه اخد برء اى عرض جنب موت كثر دهش انه قلت لبد ردء كمم طعم ههه طعم ده شكل ايه جلد يلم بيه فلس,0,0,0,0,0,1,0,1,1,0,1,1,-1
علم عم شكر بلد كرمال لقح كورو ونح هون عرف اذا رح نمت جوع او مرض بكل حول صبحو,0,0,0,0,0,1,0,1,0,0,0,9,0
حرم وطن يرن لقح نذر مآل خطر خامنئ عدو شرك لقح كورو لقح يزر لقح كورو لقح كورو,0,0,0,0,0,1,0,1,1,0,0,0,0
روس جزر تعا إنتاج لقح سبت روس جزر,0,0,0,0,0,0,0,1,1,0,0,0,1
حمدلل نعم ملك عرب سعد تم طعم جرع ولى لقح كورو الل نفع حرف نظم حفو سلس شكر وزر صحه شكر وطن,0,0,0,1,0,1,0,1,0,0,1,7,1
مصر هتستخدم لقح نصر طور فى عمل قوت سلح,0,0,0,0,0,0,0,1,0,0,0,0,1
اعل حكم سور قلل عدم تها شرء لقح كورو شعب سور لأن يتم هرب لبن سبع اول شهر,0,0,0,0,0,1,0,1,0,0,0,0,0
ملي جرع لقح حول علم كثر لاي امر وهي كثر دول علم نجح استراتيج وجس إنس كفح يرس لعن دخل اليوم كبي حصن جرع لقح غبط عله صدقاء شنط لند ومد خرى ازل حول درا ربك,0,0,0,0,0,0,0,1,0,0,0,2,1
عمل شرء لقح كورو ترك تم شكل سري غلق لنه خصص ؤيد سيس ردغ عرض الى جحم,0,0,0,0,0,1,0,1,0,0,0,0,1
لقى سفر امر جون ابي زيد جرع ثني لقح كورو وقد سفر ابي زيد خلل زير ركز لقح اود ان ؤكد جمع امر ان لقح امن فعل ان نظم كفء سعد شهد اليوم كنا غيه روع,0,0,0,0,0,1,1,1,0,1,0,1,1
عبدالل بن دفن لقه اول جرع لقح كورو نصح جمع طعم حفظ سلم سلم اسر خرت طعم,0,0,0,0,0,1,0,1,0,0,1,1,1
لقح كورو برش دعء عدل,0,0,0,0,0,1,0,1,0,0,0,9,0
وزر صحه مصر اول دول فرق بدأ طعم لقح كورو عرب,0,0,0,0,0,1,0,1,0,0,1,0,1
بكر وعد لقح امي كورو حمي رب علم طبع سأل كثر شخص ونا قنع وضع وجد صحب اخذ سبع ومر طيب حمد لله,0,0,0,0,0,1,0,1,0,0,0,7,1
بدء تلق اول ابر لقح امس ولد لدي شعر بعد حيه طبع جدد,0,0,0,0,0,0,0,1,0,0,0,7,1
طؤبر علش فيك تحك ؤمر الل بدو يفو شرح صغر جسم قدر يتح فيك سحب علم عنك عمل لقح كورو ونت يوم عمل شرط تسب جدد بلا تقر هود ال تني الل عمل حكي بال,0,0,0,0,0,1,0,1,0,0,0,7,1
علم حصل سفر امر ملك لقح كورو اكد سفر اذا كان امن وقي كورو علم فهو ملك عرب سعد,0,0,0,0,0,1,0,1,0,0,0,1,1
فرح سعد لقى لقح كورو سبب ان ابن عطه طعم,0,0,0,0,0,1,1,1,0,0,1,7,1
وهب يعل لقه لقح كورو دبي عرف منع لبن عجل حصل,0,0,0,0,0,1,0,1,0,0,0,1,1
حمدلل فضل تم اخذ جرع ثني لقح كورو ولى ريض ثني ظهر نفس رئع جمل احس قبل أفضل خدم أجمل نظم اقل حمدلل نعم سعد عظمى,0,0,0,0,0,1,0,1,0,0,0,7,1
لقح لسم لهالسلطه كمل قضء قدر وقت,0,0,0,0,0,0,0,1,0,0,0,8,0
قرر رفض لقح شكك او يتم خبر شكل بشأ كنولوج او سلم او وثق حق قبل نقش لقح امن,0,0,0,0,1,0,0,1,0,1,0,0,0
قدم امز عرض سعد بيد سرع وزع لقح كورو شهر سكت تام طرح سؤل حول اذا كانت امز قدم عرض مثل إدر رمب قدم امز سعد جرد ان تول بيد صبه وفق وير بوس,0,0,0,0,0,1,0,1,0,0,0,2,1
لقح روس سبت صنف رحل لقح كثر فعل ضد كورو,0,0,0,0,0,1,0,1,1,0,0,0,1
حمد لله لقت اليوم جرع ثني لقح كورو نظم قبل ادء منظ نسب كانت جرع ولى قدم شكر قيد رشد حرص دئم صحه فرد جمع أذكر اخذ جرع ولى ضرر اخذ جرع ثني وعد حفظ الل,0,0,0,0,0,1,0,1,0,0,0,7,1
حبت ذكر انه حدث يلم كانت تدر عام ناس تحل سبب لقح غلط,0,0,0,0,0,0,0,1,0,0,0,0,1
وزر صحه ترك ؤكد ضرر تلق جمع لقح كورو اجل ضمن عود حيه الى طبع,0,0,0,0,0,1,0,1,0,0,0,0,1
قلم قام نهج حزب الل طلب احد حكم خصص بلغ لاستيراد لقح يزر فقط عبر خسا سه تعد عليها بعض حكم شكل شرك ونس خلق حرم مكن جلب لقح اما حصر ركع صعب حصل عليها سلم حرب أمل بلل كبر,0,0,0,0,0,0,0,1,1,0,0,0,1
علم ان يلم حدث تدر عام وفه تحل ناس الى زومب سبب لقح خطئ,0,0,0,0,0,0,0,1,0,0,0,8,0
لقح امر نجح خبر سرر رغم ذلك تم عمد شكل رسم سبب وضع حرج تمر امر نرد لقح امن,0,0,0,0,0,0,0,1,0,1,0,0,-1
لأن ناج ايد طهر عقل دهش قلب نقه ولأ ثقه اثق الا لقح اير لقح امن,0,0,0,0,0,0,0,1,0,1,0,0,1
حصل لقح كورو امر خير سود توفر شكل مجا قيم حسب حصء هيئ صحه عمه سود فقد حصل قرب ال الف شخص لقح كورو سود قرر ان حصل بلغ نصف اول عام,0,0,0,0,0,1,0,1,0,0,0,2,1
سمع هرد ضيف قنه مصر يقل ان لقح كورو مش عرف مدى فعل ونه مش مهم اوى لكل يخد ومش عرف هايفضل اد ايه فى جسم بعد اد ايه مكن انس عدى تنى يرس علش مش عرف وفر يجب لين لقح قرر قلل اهم ايه,0,0,0,0,0,1,0,1,0,0,0,0,1
وقع شرك يزر ان تصل يرد عام الى لير لقح كورو طور تعا بين جره قدم جدد تطر حال كذب يقل ان علم كله خسر جئح,0,0,0,0,0,1,0,1,1,0,0,0,1
عهل غرب يدش حمل طعم ضد كورو تلق لقح ضاد يرس,0,0,0,0,0,1,0,1,0,0,1,2,1
